FA,345,, uSculpture II: Stone Carving, uMylan   Rakich, u6:10 pm,8:10 pm, uW
FA,346,, uPrintmaking, uElaine Astrea  Powell-Ascroft, u4:10 pm,6:10 pm, uR
FA,346,, uPrintmaking, uElaine Astrea  Powell-Ascroft, u9:45 am,11:45 am, uR
FA,351,, uArt History II, uLance Patrick  Pynes, u11:20 am,12:45 pm, uTR
FA,415,, uBlack and White Photography III, uPatricia L  Bognar, u2:30 pm,5:30 pm, uR
FA,418,, uDigital Photography II, uShawn K  Records, u6:20 pm,8:20 pm, uM
FRN,102,uElementary French, uTrudie M  Booth, u12:30 pm,1:25 pm, uMWF
FRN,102,, uElementary French, uTrudie M  Booth, u12:55 pm,2:20 pm, uTR
FRN,181,, uMaximizing Study Abroad, uJeffrey S  White, u8:10 am,9:05 am, uR
FRN,202,, uIntermediate French, uTrudie M  Booth, u1:35 pm,2:30 pm, uMWF
FRN,302,, uAdvanced French Conversation and Composition, uTrudie M  Booth, u2:40 pm,3:35 pm, uMWF
FRN,491,, uIntroduction to Business French, uMarianna L  Shagalova, u9:45 am,11:10 am, uTR
FRN,497I,, uFrench Internship, uJennifer   Hensley, u5:45 pm,6:55 pm, uM
FRN,497I,, uFrench Internship, uJeffrey S  White, u5:45 pm,6:55 pm, uW
GRM,102,uElementary German, uDana Lynne  Capage, u11:25 am,12:20 pm, uMWF
GRM,181,, uMaximizing Study Abroad, uJeffrey S  White, u8:10 am,9:05 am, uR
GRM,202,, uIntermediate German, uAlexandra M  Hill, u8:10 am,9:05 am, uMWF
GRM,207,, uAccelerated Intermediate German, uHans   Gabriel, u9:15 am,10:10 am, uMWF
GRM,302,, uGerman Conversation and Composition, uJeffrey S  White, u4:10 pm,5:35 pm, uMW
GRM,354,, uIntroduction to Literary and Cultural Analysis, uAlexandra M  Hill, u11:20 am,12:45 pm, uTR
GRM,407,, uText and Image in the First World War, uLaura Ann  McLary, u2:30 pm,3:55 pm, uTR
GRM,497I,, uGerman Internship, uJennifer   Hensley, u5:45 pm,6:55 pm, uM
GRM,497I,, uGerman Internship, uJeffrey S  White, u5:45 pm,6:55 pm, uW
HPE,120,uBeginning Taekwondo/Hapkido, uBrian James  Pike, u10:00 am,10:50 am, uTR
HPE,191,, uIntro to Filipino Martial Arts, uBrian James  Pike, u11:00 am,11:50 am, uTR
HPE,191,, uJeet Kune Do, uBrian James  Pike, u1:00 pm,1:50 pm, uTR
HST,210,uUnited States: Early America, uArthur F  Wheeler, u1:35 pm,2:30 pm, uMWF
HST,210,, uUnited States: Early America, uMark A  Eifler, u12:55 pm,2:20 pm, uTR
HST,211,, uUS: Modern America, uChristopher Porter  Foss, u8:10 am,9:35 am, uTR
HST,211,, uUS: Modern America, uChristin Lee  Hancock, u2:30 pm,3:55 pm, uTR
HST,211,, uUS: Modern America, uJennifer Yi-Heng  Fang, u9:45 am,11:10 am, uTR
HST,220,, uFoundations of Western Civilization, uBradley Raymond  Franco, u9:15 am,10:10 am, uMWF
HST,220,, uFoundations of Western Civilization, uBradley Raymond  Franco, u10:20 am,11:15 am, uMWF
HST,314,, uAmerican Expansion, uMark A  Eifler, u4:10 pm,5:35 pm, uTR
HST,322,, uAmerican Protest and Reform, uChristin Lee  Hancock, u9:45 am,11:10 am, uTR
HST,333,, uMedieval Europe, uBradley Raymond  Franco, u2:40 pm,4:00 pm, uMW
HST,354,, uHistory of Modern Cuba, uBlair DeWitt  Woodard, u4:10 pm,6:55 pm, uT
HST,357,, uEnvironmental History of the Americas and the World, uBlair DeWitt  Woodard, u11:20 am,12:45 pm, uTR
HST,358,, uDisease and Medicine in World History, uBrian J  Els, u11:25 am,12:20 pm, uMWF
HST,358,, uDisease and Medicine in World History, uBrian J  Els, u12:30 pm,1:25 pm, uMWF
HST,365,, uHistory of the Second World War, uArthur F  Wheeler, u7:10 pm,9:55 pm, uM
HST,391,, uBritish Empire 1815-1997, uArthur F  Wheeler, u7:10 pm,9:55 pm, uT
HST,391,, uHistory Archaeology Heritage, uMario   Ramirez Galan, u5:45 pm,7:05 pm, uMW
HST,430,, uSeminar in European History, uBrian J  Els, u2:40 pm,4:00 pm, uMW
HST,450,, uSeminar in Non-Western History, uBlair DeWitt  Woodard, u12:55 pm,2:20 pm, uTR
HST,470,, uThe Practice of History, uMark A  Eifler, u4:10 pm,5:35 pm, uMW
HON,201,uInventing the Future, uJohn C  Orr, u6:00 pm,7:00 pm, uW
HON,391,, uArchaeology of the Crusades, uMario   Ramirez Galan, u4:00 pm,5:00 pm, uM
HON,391,, uThe Art of Architecture, uElise Marie  Moentmann, u6:00 pm,7:00 pm, uT
INV,225,uIntroduction to Innovation, uEdmund Jerome  Stilwell, u2:30 pm,3:30 pm, uR
LDR,225,uFoundations of Leadership, uStephanie A  Salomone, u11:25 am,12:20 pm, uM
LDR,225,, uFoundations of Leadership, uMaureen E  Cullen, u7:10 pm,8:05 pm, uM
LDR,225,, uFoundations of Leadership, uMatthew Terrence  Daily, u5:00 pm,5:55 pm, uT
LDR,225,, uFoundations of Leadership, uAndrew M  Downs, u1:35 pm,2:30 pm, uW
LDR,225,, uFoundations of Leadership, uGina   Loschiavo, u4:30 pm,5:25 pm, uW
LDR,391,, uGlobal Perspectives on Environmental Leadership, uDavid Thomas  Houglum, u4:10 pm,5:35 pm, uW
LDR,392,, uDeveloping Academic Skills Leadership, uThomas   Giumenta, u7:10 pm,9:55 pm, uM
LDR,392,, uSocial Justice Leadership, uIrene Eneid  Routte, u10:20 am,11:15 am, uW
LDR,392,, uSojourner Scholars Program, uEduardo R  Contreras, u9:15 am,10:10 am, uF
LDR,425,, uApplied Leadership Reflection, uJeromy Alan  Koffler, u7:10 pm,8:05 pm, uM
LDR,425,, uApplied Leadership Reflection, uDavid Thomas  Houglum, u4:10 pm,5:05 pm, uT
MTH,106,uMathematics for Elementary Teachers, uLisa   Wilson, u8:10 am,9:05 am, uMWF
MTH,106,, uMathematics for Elementary Teachers, uLisa   Wilson, u9:15 am,10:10 am, uMWF
MTH,112,, uPrecalculus II, uJason Mark A  Dolor, u11:25 am,12:20 pm, uMWF
MTH,121,, uCalculus for Business and Social Science, uGary Stephen  Crook, u8:10 am,9:05 am, uMWF
MTH,121,, uCalculus for Business and Social Science, uGary Stephen  Crook, u9:15 am,10:10 am, uMWF
MTH,141,, uFinite Mathematics, uStephanie A  Salomone, u9:15 am,10:10 am, uMWF
MTH,141,, uFinite Mathematics, uPeter King  Williams, u8:10 am,9:05 am, uMWF
MTH,141,, uFinite Mathematics, uJason Mark A  Dolor, u10:20 am,11:15 am, uMWF
MTH,141,, uFinite Mathematics, uRita K  Wanner Luetkenhaus, u12:30 pm,1:25 pm, uMWF
MTH,161,, uElementary Statistics, uChristina Jo  Stauffer, u9:15 am,10:10 am, uMWF
MTH,161,, uElementary Statistics, uChristina Jo  Stauffer, u10:20 am,11:15 am, uMWF
MTH,161,, uElementary Statistics, uMatthew Jarred  McQuesten, u12:30 pm,1:25 pm, uMWF
MTH,161,, uElementary Statistics, uMatthew Jarred  McQuesten, u2:40 pm,3:35 pm, uMWF
MTH,161,, uElementary Statistics, uMichael J  Gutmann, u4:10 pm,5:35 pm, uMW
MTH,161,, uElementary Statistics, uMatthew Jarred  McQuesten, u11:20 am,12:45 pm, uTR
MTH,161,, uElementary Statistics, uChristina Jo  Stauffer, u9:45 am,11:10 am, uTR
MTH,161,, uElementary Statistics, uChristina Jo  Stauffer, u12:55 pm,2:20 pm, uTR
MTH,161,, uElementary Statistics, uMatthew Jarred  McQuesten, u2:30 pm,3:55 pm, uTR
MTH,161,, uElementary Statistics, uPardis   Navi, u4:10 pm,5:35 pm, uTR
MTH,161,, uElementary Statistics, uSharron Cay  Selman, u8:10 am,9:05 am, uMWF
MTH,161,, uElementary Statistics, uSharron Cay  Selman, u9:15 am,10:10 am, uMWF
MTH,161,, uElementary Statistics, uPardis   Navi, u2:30 pm,3:55 pm, uTR
MTH,201,, uCalculus I, uHannah L.  Highlander, u10:20 am,11:15 am, uMWF
MTH,201,, uCalculus I, uNermine   Ramadan, u8:10 am,9:05 am, uMWF
MTH,201,, uCalculus I, uHannah L.  Highlander, u1:35 pm,2:30 pm, uMWF
MTH,201,, uCalculus I, uCarolyn Susanne  James, u1:35 pm,2:30 pm, uMWF
MTH,201,, uCalculus I, uCarolyn Susanne  James, u10:20 am,11:15 am, uMWF
MTH,202,, uCalculus II, uNermine   Ramadan, u9:15 am,10:10 am, uMWF
MTH,202,, uCalculus II, uChristopher C  Hallstrom, u10:20 am,11:15 am, uMWF
MTH,202,, uCalculus II, uChristopher C  Hallstrom, u2:40 pm,3:35 pm, uMWF
MTH,202,, uCalculus II, uGregory Scott  Tyler, u8:10 am,9:05 am, uMWF
MTH,202,, uCalculus II, uJakob J  Kotas, u12:30 pm,1:25 pm, uMWF
MTH,202,, uCalculus II, uNermine   Ramadan, u2:40 pm,3:35 pm, uMWF
MTH,301,, uVector Calculus, uValerie J  Peterson, u10:20 am,11:15 am, uMWF
MTH,301,, uVector Calculus, uHans   Nordstrom, u11:25 am,12:20 pm, uMWF
MTH,301,, uVector Calculus, uAaron D  Wootton, u2:40 pm,3:35 pm, uMWF
MTH,301,, uVector Calculus, uValerie J  Peterson, u2:40 pm,3:35 pm, uMWF
MTH,304,, uComplex Variables, uChristopher R  Lee, u12:55 pm,2:20 pm, uTR
MTH,311,, uDiscrete Structures, uEli   Goldwyn, u1:35 pm,2:30 pm, uMWF
MTH,311,, uDiscrete Structures, uEli   Goldwyn, u12:30 pm,1:25 pm, uMWF
MTH,321,, uOrdinary Differential Equations, uJakob J  Kotas, u9:45 am,11:10 am, uTR
MTH,321,, uOrdinary Differential Equations, uHerbert Antonio  Medina, u8:10 am,9:35 am, uTR
MTH,321,, uOrdinary Differential Equations, uHannah L.  Highlander, u2:30 pm,3:55 pm, uTR
MTH,341,, uIntroduction to Linear Algebra, uCharles F  McCoy, u10:20 am,11:15 am, uMWF
MTH,341,, uIntroduction to Linear Algebra, uCharles F  McCoy, u1:35 pm,2:30 pm, uMWF
MTH,345,, uNumber Theory, uHans   Nordstrom, u2:40 pm,3:35 pm, uMWF
MTH,361,, uApplied Statistics I, uGregory M  Hill, u11:25 am,12:20 pm, uMWF
MTH,361,, uApplied Statistics I, uGregory M  Hill, u12:30 pm,1:25 pm, uMWF
MTH,441,, uModern Algebra I, uAaron D  Wootton, u12:30 pm,1:25 pm, uMWF
MTH,451,, uNumerical Methods in Computing I, uHeather Elizabeth  Dillon, u9:45 am,11:10 am, uTR
MTH,491,, uTopics in Algebra & Geometry, uChristopher R  Lee, u9:45 am,11:10 am, uTR
MTH,493,, uResearch in Math BIO II, uEli   Goldwyn, u9:15 am,10:10 am, uMWF
ME,222,, uEngineering Graphics, uChristopher James  Hainley, u12:30 pm,1:25 pm, uMW
ME,222,, uEngineering Graphics, uGregg   Meyer, u4:10 pm,5:35 pm, uTR
ME,222,, uEngineering Graphics, uChristopher James  Hainley, u2:40 pm,3:35 pm, uMW
ME,312,, uMechanics of Fluids II, uV Dakshina  Murty, u8:10 am,9:05 am, uWF
ME,312,, uMechanics of Fluids II, uV Dakshina  Murty, u9:15 am,10:10 am, uWF
ME,328,, uMachine Design, uKenneth E  Lulay, u12:30 pm,1:25 pm, uMWF
ME,328,, uMachine Design, uKenneth E  Lulay, u1:35 pm,2:30 pm, uMWF
ME,328H,, uMachine Design (Honors), uKenneth E  Lulay, u12:30 pm,1:25 pm, uMWF
ME,328H,, uMachine Design (Honors), uKenneth E  Lulay, u12:30 pm,1:25 pm, uMWF
ME,332,, uApplied Thermodynamics, uJordan Thomas  Farina, u8:10 am,9:05 am, uWF
ME,332,, uApplied Thermodynamics, uJordan Thomas  Farina, u9:15 am,10:10 am, uWF
ME,336,, uHeat Transfer, uJordan Thomas  Farina, u9:45 am,11:10 am, uTR
ME,336,, uHeat Transfer, uHeather Elizabeth  Dillon, u11:20 am,12:45 pm, uTR
ME,374,, uFluids Laboratory, uV Dakshina  Murty, u2:40 pm,4:40 pm, uM
ME,374,, uFluids Laboratory, uNikolene Anne  Schulz, u2:40 pm,4:40 pm, uT
ME,374,, uFluids Laboratory, uV Dakshina  Murty, u11:25 am,1:25 pm, uM
ME,374,, uFluids Laboratory, uV Dakshina  Murty, u2:40 pm,4:40 pm, uW
ME,376,, uThermodynamics Laboratory, uShazib Z  Vijlee, u5:00 pm,7:00 pm, uM
ME,376,, uThermodynamics Laboratory, uShazib Z  Vijlee, u5:00 pm,7:10 pm, uW
ME,434,, uEnergy Efficiency in Buildings, uMegan Michele  Tosh, u4:10 pm,5:35 pm, uTR
ME,453,, uMechanical Vibrations, uHamid   Rad, u7:10 pm,9:55 pm, uR
ME,484,, uMechanical Engineering Capstone Project II, uJennifer Elaine  Symons, u2:40 pm,5:40 pm, uF
ME,484,, uMechanical Engineering Capstone Project II, uTimothy A  Doughty, u2:40 pm,5:40 pm, uF
ME,484,, uMechanical Engineering Capstone Project II, uJennifer Elaine  Symons, u2:40 pm,5:40 pm, uF
ME,484H,, uMechanical Engineering Capstone II (Honors), uTimothy A  Doughty, u2:40 pm,5:40 pm, uF
ME,491,, uAircraft Dynamics and Control, uChristina M  Ivler, u4:10 pm,5:35 pm, uTR
ME,534,, uEnergy Efficiency in Buildings, uMegan Michele  Tosh, u4:10 pm,5:35 pm, uTR
ME,553,, uMechanical Vibrations, uHamid   Rad, u7:10 pm,9:55 pm, uR
ME,591,, uAircraft Dynamics and Control, uChristina M  Ivler, u4:10 pm,5:35 pm, uTR
MSL,102,uFoundations of Agile and Adaptive Leadership, uJessy L.  Claerhout, u4:10 pm,5:00 pm, uT
MSL,122,, uLeadership Laboratory, uJessy L.  Claerhout, u4:10 pm,6:30 pm, uR
MSL,132,, uBasic Course Physical Fitness, uJessy L.  Claerhout, u6:00 am,7:30 am, uMWF
MSL,202,, uArmy Doctrine and Team Development, uJoshua T  Motes, u4:10 pm,6:00 pm, uT
MSL,222,, uLeadership Laboratory, uJoshua T  Motes, u4:10 pm,6:30 pm, uR
MSL,232,, uBasic Course Physical Fitness, uJoshua T  Motes, u6:00 am,7:30 am, uMWF
MSL,302,, uApplied Leadership in Small Unit Operations, uGlenn L  Darr, u4:10 pm,6:50 pm, uT
MSL,322,, uAdvanced Leadership Laboratory, uGlenn L  Darr, u4:10 pm,6:30 pm, uR
MSL,332,, uAdvanced Course Physical Fitness, uGlenn L  Darr, u6:00 am,7:30 am, uMWF
MSL,402,, uCompany Grade Leadership, uKiernan Patrick  White, u4:10 pm,6:50 pm, uT
MSL,422,, uAdvanced Leadership Laboratory, uKiernan Patrick  White, u4:10 pm,6:30 pm, uR
MSL,432,, uAdvanced Course Physical Fitness, uKiernan Patrick  White, u6:00 am,7:30 am, uMWF
MUS,001,uPerformance Attendance, uNicole H. L.  Hanig, u12:30 pm,1:30 pm, uW
MUS,102,, uMusic Theory II, uDavid Michael  De Lyser, u11:25 am,12:20 pm, uMWF
MUS,104,, uAural Skills II, uJennifer Lynn  Wanner, u9:45 am,11:10 am, uTR
MUS,130,, uClass Piano I, uTracey Dean  Edson, u9:15 am,10:10 am, uMW
MUS,202,, uMusic Theory IV, uPatrick C  Murphy, u9:15 am,10:10 am, uMWF
MUS,230,, uClass Piano II, uTracey Dean  Edson, u11:25 am,12:20 pm, uMW
MUS,231,, uPiano Proficiency II, uTracey Dean  Edson, u10:20 am,11:15 am, uMW
MUS,236,, uBeginning Guitar, uJeffrey Carter  Ashton, u6:10 pm,7:05 pm, uR
MUS,236,, uBeginning Guitar, uJeffrey Carter  Ashton, u7:10 pm,8:05 pm, uR
MUS,243,, uWind Symphony, uPatrick C  Murphy, u4:10 pm,5:35 pm, uMW
MUS,244,, uUniversity of Portland Singers, uDavid Michael  De Lyser, u1:35 pm,2:30 pm, uMWF
MUS,245,, uUniversity Orchestra, uAdam   LaMotte, u7:00 pm,9:30 pm, uT
MUS,246,, uChapel Music Ensemble, uMaureen Kuffner  Briare, u4:10 pm,5:35 pm, uW
MUS,253,, uUniversity Jazz Ensemble, uDon   Norton, u4:10 pm,5:35 pm, uTR
MUS,302,, uMusic History II, uLucy C  Shanno, u11:20 am,12:45 pm, uTR
MUS,303,, uIntroduction to Classical Music, uLucy C  Shanno, u8:10 am,9:35 am, uTR
MUS,309,, uWorld Music, uJulia Lynn  Banzi, u9:45 am,11:10 am, uTR
MUS,310,, uFundamentals of Music Technology, uHarold   Logan, u2:30 pm,3:55 pm, uTR
MUS,341,, uFundamentals of Music Education, uPatrick C  Murphy, u11:00 am,12:45 pm, uR
MUS,411,, uHistory of Rock and Roll, uDon   Norton, u12:55 pm,2:20 pm, uTR
MUS,412,, uHistory of Musical Theatre, uMead K  Hunter, u1:35 pm,2:30 pm, uMWF
MUS,443,, uWind Symphony, uPatrick C  Murphy, u4:10 pm,5:35 pm, uMW
MUS,444,, uUniversity Singers, uDavid Michael  De Lyser, u1:35 pm,2:30 pm, uMWF
MUS,445,, uUniversity Orchestra, uAdam   LaMotte, u7:00 pm,9:30 pm, uT
MUS,446,, uChapel Music Ensemble, uMaureen Kuffner  Briare, u4:10 pm,5:35 pm, uW
MUS,453,, uUniversity Jazz Ensemble, uDon   Norton, u4:10 pm,5:35 pm, uTR
NRS,072,uLab: Introduction to Professional Nursing Practice, uMichelle Elizabeth  King, u8:30 am,11:00 am, uM
NRS,072,, uLab: Introduction to Professional Nursing Practice, uMichelle Elizabeth  King, u12:30 pm,3:00 pm, uM
NRS,072,, uLab: Introduction to Professional Nursing Practice, uEmma Christine  Smith, u3:30 pm,6:00 pm, uM
NRS,072,, uLab: Introduction to Professional Nursing Practice, uEmma Christine  Smith, u8:30 am,11:00 am, uT
NRS,116,, uHealth and Wellness Across the Lifespan I, uPamela Joy  Potter, u8:10 am,9:35 am, uTR
NRS,116,, uHealth and Wellness Across the Lifespan I, uPamela Joy  Potter, u9:45 am,11:10 am, uTR
NRS,116,, uHealth and Wellness Across the Lifespan I, uIsabelle Lacy  Soule, u8:10 am,9:05 am, uMWF
NRS,116,, uHealth and Wellness Across the Lifespan I, uIsabelle Lacy  Soule, u9:15 am,10:10 am, uMWF
NRS,116,, uHealth and Wellness Across the Lifespan I, uIsabelle Lacy  Soule, u12:30 pm,1:25 pm, uMWF
NRS,116,, uHealth and Wellness Across the Lifespan I, uBradley Scott  Huit, u4:10 pm,5:35 pm, uMW
NRS,116,, uHealth and Wellness Across the Lifespan I, uGordon Scott  Williamson, u2:40 pm,4:00 pm, uMW
NRS,202,, uNutrition, uKaren M  Kessi, u12:55 pm,2:20 pm, uTR
NRS,202,, uNutrition, uTanya Rochelle  Bachman, u4:10 pm,6:55 pm, uW
NRS,203,, uLife Processes Across the Lifespan, uBeverly Kaye  Wilson-Anderson, u2:30 pm,3:55 pm, uTR
NRS,291,, uMind Body Energy Perspectives, uPamela Joy  Potter, u4:10 pm,6:55 pm, uW
NRS,301,, uNursing Theory and Knowing: Concepts and Issues, uLaura C  Mood, u10:00 am,11:50 am, uR
NRS,301,, uNursing Theory and Knowing: Concepts and Issues, uLaura C  Mood, u1:40 pm,3:30 pm, uW
NRS,310,, uMulticultural Population Health Promotion, uLayla Jamil  Garrigues, u10:00 am,11:50 am, uW
NRS,310,, uMulticultural Population Health Promotion, uLayla Jamil  Garrigues, u2:30 pm,4:20 pm, uT
NRS,311,, uCommunication in Nursing, uLaura C  Mood, u2:00 pm,3:50 pm, uT
NRS,311,, uCommunication in Nursing, uLaura C  Mood, u8:00 am,9:50 am, uR
NRS,312,, uIntroduction to Professional Nursing Practice, uHolly Jean  Simpson, u1:30 pm,3:20 pm, uMW
NRS,312,, uIntroduction to Professional Nursing Practice, uAnjanette M  Raber, u12:00 pm,1:50 pm, uTR
NRS,313,, uPathophysiology, uLorretta C  Krautscheid, u12:00 pm,1:25 pm, uTR
NRS,313,, uPathophysiology, uHolly Jean  Simpson, u10:00 am,11:25 am, uMW
NRS,315,, uPharmacotherapeutics, uHalina Zawadzki  Wyss, u12:00 pm,2:45 pm, uF
NRS,315,, uPharmacotherapeutics, uBriana Marie  Rotter, u8:30 am,11:15 am, uM
NRS,315,, uPharmacotherapeutics, uHalina Zawadzki  Wyss, u8:30 am,11:15 am, uT
NRS,315,, uPharmacotherapeutics, uHalina Zawadzki  Wyss, u1:00 pm,3:45 pm, uW
NRS,321,, uPsychiatric Mental Health Nursing, uSally Stephanie  Rothacker-Peyton, u8:00 am,9:50 am, uF
NRS,321,, uPsychiatric Mental Health Nursing, uSally Stephanie  Rothacker-Peyton, u12:00 pm,1:50 pm, uF
NRS,321,, uPsychiatric Mental Health Nursing, uSally Stephanie  Rothacker-Peyton, u1:40 pm,3:30 pm, uM
NRS,321,, uPsychiatric Mental Health Nursing, uSally Stephanie  Rothacker-Peyton, u10:00 am,11:50 am, uT
NRS,322,, uAdult and Elder Health I, uLori Ann  Chorpenning, u8:00 am,10:45 am, uR
NRS,322,, uAdult and Elder Health I, uLori Ann  Chorpenning, u8:15 am,11:00 am, uF
NRS,322,, uAdult and Elder Health I, uNicole Elaine  Auxier, u12:30 pm,3:15 pm, uT
NRS,322,, uAdult and Elder Health I, uNicole Elaine  Auxier, u8:15 am,11:00 am, uM
NRS,361,, uClinical: Psychiatric Mental Health Nursing, uGrace Arden Kwan  Wick, u7:00 am,5:00 pm, uTW
NRS,361,, uClinical: Psychiatric Mental Health Nursing, uTimothy Franklin  Winslea, u2:00 pm,11:30 pm, uTW
NRS,361,, uClinical: Psychiatric Mental Health Nursing, uPaulette   Adlard, u7:00 am,5:00 pm, uRF
NRS,361,, uClinical: Psychiatric Mental Health Nursing, uBeth L  Holloway, u7:00 am,7:30 pm, uTW
NRS,361,, uClinical: Psychiatric Mental Health Nursing, uHalley Sybil Sharee Aladore  Frishkorn, u7:00 am,5:00 pm, uRF
NRS,361,, uClinical: Psychiatric Mental Health Nursing, uNancy Davis  Hodges, u7:00 am,5:00 pm, uTW
NRS,361,, uClinical: Psychiatric Mental Health Nursing, uPatricia L  Zylawy, u7:00 am,5:00 pm, uRF
NRS,361,, uClinical: Psychiatric Mental Health Nursing, uJoetta Mae  Moon, u7:00 am,5:00 pm, uRF
NRS,361,, uClinical: Psychiatric Mental Health Nursing, uMarlena K  Buen, u7:00 am,5:00 pm, uTW
NRS,361,, uClinical: Psychiatric Mental Health Nursing, uRebecca Ann  Mickel, u7:00 am,5:00 pm, uTW
NRS,361,, uClinical: Psychiatric Mental Health Nursing, uRebecca Ann  Mickel, u7:00 am,5:00 pm, uRF
NRS,361,, uClinical: Psychiatric Mental Health Nursing, uKaren Alice  Steinke, u7:00 am,5:00 pm, uRF
NRS,361,, uClinical: Psychiatric Mental Health Nursing, uGrace Arden Kwan  Wick, u7:00 am,5:00 pm, uRF
NRS,361,, uClinical: Psychiatric Mental Health Nursing, uNancy Davis  Hodges, u7:00 am,5:00 pm, uTW
NRS,361,, uClinical: Psychiatric Mental Health Nursing, uTimothy Franklin  Winslea, u2:00 pm,11:30 pm, uTW
NRS,361,, uClinical: Psychiatric Mental Health Nursing, uCarlyn Day  Chamberlain, u7:00 am,5:00 pm, uRF
NRS,361,, uClinical: Psychiatric Mental Health Nursing, uBeth L  Holloway, u7:00 am,7:30 pm, uTW
NRS,361,, uClinical: Psychiatric Mental Health Nursing, uHalley Sybil Sharee Aladore  Frishkorn, u7:00 am,5:00 pm, uRF
NRS,361,, uClinical: Psychiatric Mental Health Nursing, uPatricia L  Zylawy, u7:00 am,5:00 pm, uRF
NRS,361,, uClinical: Psychiatric Mental Health Nursing, uJoetta Mae  Moon, u7:00 am,5:00 pm, uRF
NRS,361,, uClinical: Psychiatric Mental Health Nursing, uMarlena K  Buen, u7:00 am,5:00 pm, uTW
NRS,361,, uClinical: Psychiatric Mental Health Nursing, uRebecca Ann  Mickel, u7:00 am,5:00 pm, uTW
NRS,361,, uClinical: Psychiatric Mental Health Nursing, uRebecca Ann  Mickel, u7:00 am,5:00 pm, uRF
NRS,361,, uClinical: Psychiatric Mental Health Nursing, uKaren Alice  Steinke, u7:00 am,5:00 pm, uRF
NRS,361,, uClinical: Psychiatric Mental Health Nursing, uGrace Arden Kwan  Wick, u7:00 am,5:00 pm, uRF
NRS,361,, uClinical: Psychiatric Mental Health Nursing, uJoetta Mae  Moon, u7:00 am,5:00 pm, uTW
NRS,362,, uClinical: Physiological Nursing, uNikki   Warthen, u7:00 am,5:00 pm, uTW
NRS,362,, uClinical: Physiological Nursing, uMary R  Stevenson, u7:00 am,5:00 pm, uRF
NRS,362,, uClinical: Physiological Nursing, uMary R  Stevenson, u7:00 am,5:00 pm, uRF
NRS,362,, uClinical: Physiological Nursing, uWendy L  Votroubek, u6:00 am,4:00 pm, uTW
NRS,362,, uClinical: Physiological Nursing, uDeana   Lenihan, u6:00 am,4:00 pm, uRF
NRS,362,, uClinical: Physiological Nursing, uDixie N  Hofer, u6:00 am,4:00 pm, uTW
NRS,362,, uClinical: Physiological Nursing, uLori Ann  Chorpenning, u7:00 am,5:00 pm, uTW
NRS,362,, uClinical: Physiological Nursing, uNikki   Warthen, u7:00 am,5:00 pm, uRF
NRS,362,, uClinical: Physiological Nursing, uNikki   Warthen, u7:00 am,5:00 pm, uRF
NRS,362,, uClinical: Physiological Nursing, uLaura Katherine  Blackhurst, u7:00 am,5:00 pm, uTW
NRS,362,, uClinical: Physiological Nursing, uLaura Katherine  Blackhurst, u7:00 am,5:00 pm, uTW
NRS,362,, uClinical: Physiological Nursing, uHolly Jean  Simpson, u1:00 pm,10:30 pm, uRF
NRS,362,, uClinical: Physiological Nursing, uLisa Baongan  Le-Vaughan, u7:00 am,5:00 pm, uRF
NRS,362,, uClinical: Physiological Nursing, uNikki   Warthen, u7:00 am,5:00 pm, uRF
NRS,362,, uClinical: Physiological Nursing, uNikki   Warthen, u7:00 am,5:00 pm, uTW
NRS,362,, uClinical: Physiological Nursing, uMary R  Stevenson, u7:00 am,5:00 pm, uRF
NRS,362,, uClinical: Physiological Nursing, uNikki   Warthen, u7:00 am,5:00 pm, uTW
NRS,362,, uClinical: Physiological Nursing, uMary R  Stevenson, u7:00 am,5:00 pm, uRF
NRS,362,, uClinical: Physiological Nursing, uWendy L  Votroubek, u6:00 am,4:00 pm, uTW
NRS,362,, uClinical: Physiological Nursing, uDeana   Lenihan, u6:00 am,4:00 pm, uRF
NRS,362,, uClinical: Physiological Nursing, uDixie N  Hofer, u6:00 am,4:00 pm, uTW
NRS,362,, uClinical: Physiological Nursing, uLori Ann  Chorpenning, u7:00 am,5:00 pm, uTW
NRS,362,, uClinical: Physiological Nursing, uNikki   Warthen, u7:00 am,5:00 pm, uRF
NRS,362,, uClinical: Physiological Nursing, uNikki   Warthen, u7:00 am,5:00 pm, uRF
NRS,362,, uClinical: Physiological Nursing, uLaura Katherine  Blackhurst, u7:00 am,5:00 pm, uTW
NRS,362,, uClinical: Physiological Nursing, uLaura Katherine  Blackhurst, u7:00 am,5:00 pm, uTW
NRS,362,, uClinical: Physiological Nursing, uMolly   Sperry, u1:00 pm,10:30 pm, uRF
NRS,362,, uClinical: Physiological Nursing, uLisa Baongan  Le-Vaughan, u7:00 am,5:00 pm, uRF
NRS,362,, uClinical: Physiological Nursing, uNikki   Warthen, u7:00 am,5:00 pm, uRF
NRS,392,, uApplied Leadership in Holistic Wellness, uJanet M  Banks, u7:00 pm,8:00 pm, uM
NRS,418,, uNursing of Families, uSeptember Theresa  Nelson, u1:00 pm,2:50 pm, uF
NRS,418,, uNursing of Families, uJanet M  Banks, u3:00 pm,4:50 pm, uT
NRS,418,, uNursing of Families, uAmber Lea  Vermeesch, u10:30 am,12:20 pm, uW
NRS,421,, uAdult and Elder Health II, uLaura Katherine  Blackhurst, u9:00 am,11:45 am, uF
NRS,422,, uMaternal-Child Nursing, uJanet M  Banks, u12:30 pm,2:20 pm, uTW
NRS,422,, uMaternal-Child Nursing, uTheresa Ann  Duda, u8:00 am,9:50 am, uTW
NRS,424,, uApplied Population Health Nursing in a Multicultural Context, uKala A  Mayer, u8:00 am,10:45 am, uR
NRS,424,, uApplied Population Health Nursing in a Multicultural Context, uKala A  Mayer, u8:30 am,11:15 am, uM
NRS,424,, uApplied Population Health Nursing in a Multicultural Context, uLayla Jamil  Garrigues, u1:30 pm,4:15 pm, uM
NRS,429,, uLeadership in Professional Nursing, uKelly Kareen  McCoy, u2:00 pm,4:45 pm, uR
NRS,429,, uLeadership in Professional Nursing, uJoan H  Caley, u2:00 pm,4:45 pm, uR
NRS,429,, uLeadership in Professional Nursing, uKelly Ann  Fox, u2:00 pm,4:45 pm, uR
NRS,429,, uLeadership in Professional Nursing, uSeptember Theresa  Nelson, u2:00 pm,4:45 pm, uR
NRS,436,, uPreparation for Professional Practice, uBeverly Kaye  Wilson-Anderson, u11:00 am,12:50 pm, uR
NRS,436,, uPreparation for Professional Practice, uBeverly Kaye  Wilson-Anderson, u11:00 am,12:50 pm, uR
NRS,436,, uPreparation for Professional Practice, uBeverly Kaye  Wilson-Anderson, u9:00 am,10:50 am, uR
NRS,436,, uPreparation for Professional Practice, uSeptember Theresa  Nelson, u11:00 am,12:50 pm, uR
NRS,461,, uClinical: Advanced Physiological Nursing, uKaren Alice  Steinke, u7:00 am,7:30 pm, uTW
NRS,461,, uClinical: Advanced Physiological Nursing, uLisa Baongan  Le-Vaughan, u7:00 am,5:00 pm, uTW
NRS,461,, uClinical: Advanced Physiological Nursing, uStephanie Anne  Meyer, u7:00 am,5:00 pm, uTW
NRS,461,, uClinical: Advanced Physiological Nursing, uDiana Lee  Anderson, u7:00 am,5:00 pm, uTW
NRS,461,, uClinical: Advanced Physiological Nursing, uKaren Alice  Steinke, u7:00 am,7:30 pm, uTW
NRS,461,, uClinical: Advanced Physiological Nursing, uStephanie Anne  Meyer, u7:00 am,5:00 pm, uTW
NRS,461,, uClinical: Advanced Physiological Nursing, uDiana Lee  Anderson, u7:00 am,5:00 pm, uTW
NRS,462,, uClinical: Maternal-Child Nursing, uAmber Kay  Baker, u6:30 am,7:00 pm, uFS
NRS,462,, uClinical: Maternal-Child Nursing, uHannah LeeAnn  Irvine, u7:00 am,7:30 pm, uRF
NRS,462,, uClinical: Maternal-Child Nursing, uKim Christine  Vermilya, u7:00 am,7:30 pm, uR
NRS,462,, uClinical: Maternal-Child Nursing, uFrances J.  Simmons, u6:30 am,7:00 pm, uFS
NRS,462,, uClinical: Maternal-Child Nursing, uTheresa Ann  Duda, u7:00 am,5:00 pm, uRF
NRS,462,, uClinical: Maternal-Child Nursing, uGordon Scott  Williamson, u1:00 pm,11:30 pm, uRF
NRS,462,, uClinical: Maternal-Child Nursing, uJill   Walsh, u6:30 am,7:00 pm, uFS
