NRS,462,, uClinical: Maternal-Child Nursing, uStefanie Marie  Dieffenbach, u7:00 am,7:30 pm, uRF
NRS,462,, uClinical: Maternal-Child Nursing, uSherry Lynn  Hutton, u7:00 am,7:30 pm, uFS
NRS,462,, uClinical: Maternal-Child Nursing, uFrances J.  Simmons, u6:30 am,7:00 pm, uFS
NRS,462,, uClinical: Maternal-Child Nursing, uGordon Scott  Williamson, u1:00 pm,11:30 pm, uRF
NRS,464,, uClinical: Applied Population Health Nursing in a Multicultural Context, uJoan H  Caley, u8:00 am,8:00 pm, uTW
NRS,464,, uClinical: Applied Population Health Nursing in a Multicultural Context, uLinda J  Smith, u8:00 am,8:00 pm, uRF
NRS,464,, uClinical: Applied Population Health Nursing in a Multicultural Context, uFrances J.  Simmons, u7:00 am,5:00 pm, uTW
NRS,464,, uClinical: Applied Population Health Nursing in a Multicultural Context, uElizabeth Ann  Baynes, u7:00 am,5:00 pm, uRF
NRS,464,, uClinical: Applied Population Health Nursing in a Multicultural Context, uMollie Ekern  Swift, u8:00 am,8:00 pm, uRF
NRS,464,, uClinical: Applied Population Health Nursing in a Multicultural Context, uSusan Lee  Chauvie, u8:00 am,8:00 pm, uRF
NRS,464,, uClinical: Applied Population Health Nursing in a Multicultural Context, uMargaret   McComb, u8:00 am,8:00 pm, uTW
NRS,464,, uClinical: Applied Population Health Nursing in a Multicultural Context, uMargaret   McComb, u8:00 am,8:00 pm, uRF
NRS,464,, uClinical: Applied Population Health Nursing in a Multicultural Context, uJoan H  Caley, u8:00 am,8:00 pm, uTW
NRS,464,, uClinical: Applied Population Health Nursing in a Multicultural Context, uLinda J  Smith, u8:00 am,8:00 pm, uRF
NRS,464,, uClinical: Applied Population Health Nursing in a Multicultural Context, uFrances J.  Simmons, u7:00 am,5:00 pm, uTW
NRS,464,, uClinical: Applied Population Health Nursing in a Multicultural Context, uElizabeth Ann  Baynes, u7:00 am,5:00 pm, uRF
NRS,464,, uClinical: Applied Population Health Nursing in a Multicultural Context, uMollie Ekern  Swift, u8:00 am,8:00 pm, uRF
NRS,464,, uClinical: Applied Population Health Nursing in a Multicultural Context, uSusan Lee  Chauvie, u8:00 am,8:00 pm, uRF
NRS,464,, uClinical: Applied Population Health Nursing in a Multicultural Context, uMargaret   McComb, u8:00 am,8:00 pm, uTW
NRS,464,, uClinical: Applied Population Health Nursing in a Multicultural Context, uMargaret   McComb, u8:00 am,8:00 pm, uRF
NRS,606,, uQuality Improvement Processes of Practice Improvement, uJoanne   Olsen, u3:45 pm,6:45 pm, uSU
NRS,607,, uAdvanced Pathophysiology and Genetics, uLuis Fernando  Carrillo, u8:30 am,12:30 pm, uSU
NRS,650,, uInformatics in a Complex Healthcare Environment, uJoanne   Olsen, u1:30 pm,3:30 pm, uSU
NRS,661,, uDNP Scholarly Project II, uPatricia Helen  Cox, u8:15 am,10:15 am, uU
PHL,150,uIntroductory Philosophy, uDylan   Dodd, u8:10 am,9:05 am, uMWF
PHL,150,, uIntroductory Philosophy, uJessica E  Logue, u9:15 am,10:10 am, uMWF
PHL,150,, uIntroductory Philosophy, uJamie   Hardy, u10:20 am,11:15 am, uMWF
PHL,150,, uIntroductory Philosophy, uJessica E  Logue, u11:25 am,12:20 pm, uMWF
PHL,150,, uIntroductory Philosophy, uJeffrey A  Gauthier, u12:30 pm,1:25 pm, uMWF
PHL,150,, uIntroductory Philosophy, uJeremy   Millington, u12:30 pm,1:25 pm, uMWF
PHL,150,, uIntroductory Philosophy, uJeremy   Millington, u1:35 pm,2:30 pm, uMWF
PHL,150,, uIntroductory Philosophy, uCharles   Sullivan, u1:35 pm,2:30 pm, uMWF
PHL,150,, uIntroductory Philosophy, uMichael Scott  Pankrast, u2:40 pm,3:35 pm, uMWF
PHL,150,, uIntroductory Philosophy, uJeffrey A  Gauthier, u7:10 pm,8:35 pm, uMW
PHL,150,, uIntroductory Philosophy, uJamie   Hardy, u7:10 pm,8:35 pm, uMW
PHL,150,, uIntroductory Philosophy, uLara M  Trout, u4:10 pm,6:55 pm, uW
PHL,150,, uIntroductory Philosophy, uBrett Eugene  Hackett, u7:10 pm,9:55 pm, uW
PHL,150,, uIntroductory Philosophy, uChristian Anne  Nelsen, u8:10 am,9:35 am, uTR
PHL,150,, uIntroductory Philosophy, uCaery A  Evangelist, u9:45 am,11:10 am, uTR
PHL,150,, uIntroductory Philosophy, uColin M  Patrick, u9:45 am,11:10 am, uTR
PHL,150,, uIntroductory Philosophy, uChristopher   Manno, u11:20 am,12:45 pm, uTR
PHL,150,, uIntroductory Philosophy, uColin M  Patrick, u12:55 pm,2:20 pm, uTR
PHL,150,, uIntroductory Philosophy, uDavid   Denny, u2:30 pm,3:55 pm, uTR
PHL,150,, uIntroductory Philosophy, uDavid   Denny, u7:10 pm,8:35 pm, uTR
PHL,150,, uIntroductory Philosophy, uLara M  Trout, u4:10 pm,6:55 pm, uT
PHL,150,, uIntroductory Philosophy, uBrett Eugene  Hackett, u7:10 pm,9:55 pm, uT
PHL,220,, uEthics, uJames   Baillie, u8:10 am,9:05 am, uMWF
PHL,220,, uEthics, uJames   Baillie, u9:15 am,10:10 am, uMWF
PHL,220,, uEthics, uSruthi Rachel  Rothenfluch, u9:15 am,10:10 am, uMWF
PHL,220,, uEthics, uDylan   Dodd, u10:20 am,11:15 am, uMWF
PHL,220,, uEthics, uGretchen Marie  Gusich, u10:20 am,11:15 am, uMWF
PHL,220,, uEthics, uGretchen Marie  Gusich, u11:25 am,12:20 pm, uMWF
PHL,220,, uEthics, uSruthi Rachel  Rothenfluch, u12:30 pm,1:25 pm, uMWF
PHL,220,, uEthics, uSruthi Rachel  Rothenfluch, u1:35 pm,2:30 pm, uMWF
PHL,220,, uEthics, uJessica E  Logue, u4:10 pm,6:55 pm, uM
PHL,220,, uEthics, uPatricia   McShane, u8:10 am,9:35 am, uTR
PHL,220,, uEthics, uAndrew Scott  Eshleman, u11:20 am,12:45 pm, uTR
PHL,220,, uEthics, uPatricia   McShane, u12:55 pm,2:20 pm, uTR
PHL,220,, uEthics, uAndrew Scott  Eshleman, u2:30 pm,3:55 pm, uTR
PHL,220,, uEthics, uChristopher   Manno, u7:10 pm,8:35 pm, uTR
PHL,220,, uEthics, uRichard R  Askay, u4:10 pm,6:55 pm, uT
PHL,313,, uSocio-Political Philosophy, uJeffrey A  Gauthier, u11:25 am,12:20 pm, uMWF
PHL,321,, uLogic, uPatricia   McShane, u11:20 am,12:45 pm, uTR
PHL,332,, uMetaphysics: Philosophy of Mind, uJames   Baillie, u2:40 pm,4:00 pm, uMW
PHL,333,, uMetaphysics: Philosophy of Religion, uAndrew Scott  Eshleman, u4:10 pm,5:35 pm, uMW
PHL,334,, uMetaphysics: Problem of Being, uDouglas L  Donkel, u4:10 pm,6:55 pm, uR
PHL,335,, uMetaphysics: Self and Identity, uLara M  Trout, u9:45 am,11:10 am, uTR
PHL,374,, uHegel and 19th Century Philosophy, uRichard R  Askay, u12:55 pm,2:20 pm, uTR
PHL,391,, uMetaphysics & Epistemology, uSruthi Rachel  Rothenfluch, u9:45 am,11:10 am, uTR
PHL,391,, uHeat Hunger and Hurricanes, uNorah A  Martin, u4:10 pm,6:55 pm, uT
PHL,391,, uMetaphysics & Sci Revolution, uCaery A  Evangelist, u2:30 pm,3:55 pm, uTR
PHY,109,uPowerful Ideas in Physical Science, uTamar   More, u12:55 pm,2:20 pm, uTR
PHY,109,, uPowerful Ideas in Physical Science, uElliot Eckman  Mylott, u9:15 am,10:10 am, uMWF
PHY,202,, uCollege Physics II, uElliot Eckman  Mylott, u8:10 am,9:35 am, uTR
PHY,202,, uCollege Physics II, uShannon Kathleen  Mayer, u11:20 am,12:45 pm, uTR
PHY,202,, uCollege Physics II, uElliot Eckman  Mylott, u11:20 am,12:45 pm, uTR
PHY,204,, uGeneral Physics I, uNilushi Lakmali  Dasanayake, u9:15 am,10:10 am, uMWF
PHY,204,, uGeneral Physics I, uOsiel A  Bonfim, u10:20 am,11:15 am, uMWF
PHY,205,, uGeneral Physics II, uMaximilian   Schlosshauer, u10:20 am,11:15 am, uMWF
PHY,205,, uGeneral Physics II, uTamar   More, u11:25 am,12:20 pm, uMWF
PHY,205,, uGeneral Physics II, uOsiel A  Bonfim, u12:30 pm,1:25 pm, uMWF
PHY,205,, uGeneral Physics II, uTamar   More, u1:35 pm,2:30 pm, uMWF
PHY,205,, uGeneral Physics II, uElliot Eckman  Mylott, u2:40 pm,3:35 pm, uMWF
PHY,205,, uGeneral Physics II, uPunam   Ghimire, u9:15 am,10:10 am, uMWF
PHY,205,, uGeneral Physics II, uMaximilian   Schlosshauer, u12:30 pm,1:25 pm, uMWF
PHY,272,, uCollege Physics Lab II, uPunam   Ghimire, u2:40 pm,5:40 pm, uM
PHY,272,, uCollege Physics Lab II, uJose L.  Vazquez Bello, u2:30 pm,5:30 pm, uT
PHY,272,, uCollege Physics Lab II, uSean A.  Yeager, u2:40 pm,5:40 pm, uW
PHY,272,, uCollege Physics Lab II, uJose L.  Vazquez Bello, u2:30 pm,5:30 pm, uR
PHY,274,, uGeneral Physics Lab I, uNilushi Lakmali  Dasanayake, u10:20 am,11:15 am, uMWF
PHY,274,, uGeneral Physics Lab I, uAaron B  Doud, u9:15 am,10:10 am, uMWF
PHY,275,, uGeneral Physics Lab II, uJames P.  McPhee, u11:25 am,12:20 pm, uMWF
PHY,275,, uGeneral Physics Lab II, uAaron B  Doud, u10:20 am,11:15 am, uMWF
PHY,275,, uGeneral Physics Lab II, uJames P.  McPhee, u1:35 pm,2:30 pm, uMWF
PHY,275,, uGeneral Physics Lab II, uJames P.  McPhee, u12:30 pm,1:25 pm, uMWF
PHY,275,, uGeneral Physics Lab II, uAaron B  Doud, u1:35 pm,2:30 pm, uMWF
PHY,275,, uGeneral Physics Lab II, uPunam   Ghimire, u8:10 am,9:05 am, uMWF
PHY,275,, uGeneral Physics Lab II, uAaron B  Doud, u11:25 am,12:20 pm, uMWF
PHY,306,, uModern Physics, uOsiel A  Bonfim, u11:25 am,12:20 pm, uMWF
PHY,322,, uOptics, uShannon Kathleen  Mayer, u8:10 am,9:35 am, uTR
PHY,372,, uOptics Laboratory, uShannon Kathleen  Mayer, u1:35 pm,4:35 pm, uM
PHY,376,, uModern Physics Lab, uMaximilian   Schlosshauer, u1:35 pm,4:35 pm, uW
PHY,472,, uAdvanced Optics Laboratory, uShannon Kathleen  Mayer, u1:35 pm,4:35 pm, uM
POL,200,uIntroduction to United States Politics, uJeffrey W  Meiser, u10:20 am,11:15 am, uMWF
POL,200,, uIntroduction to United States Politics, uGary L  Malecha, u8:10 am,9:35 am, uTR
POL,203,, uIntroduction to Political Theory, uWilliam M  Curtis, u2:40 pm,4:00 pm, uMW
POL,205,, uWorld Politics, uLara-Zuzan   Golesorkhi, u9:15 am,10:10 am, uMWF
POL,205,, uWorld Politics, uLara-Zuzan   Golesorkhi, u11:25 am,12:20 pm, uMWF
POL,292,, uUniversity Mock Trial Team, uCurtiss Aaron  Johnson, u7:10 pm,9:55 pm, uMR
POL,314,, uAmerican Political Thought, uGary L  Malecha, u11:20 am,12:45 pm, uTR
POL,319,, uPolitics and Identity, uLara-Zuzan   Golesorkhi, u12:55 pm,2:20 pm, uTR
POL,321,, uPolitics of Hip Hop, uJeffrey W  Meiser, u1:35 pm,2:30 pm, uMWF
POL,345,, uConstitutional Law II: Civil Liberties and Rights, uWilliam M  Curtis, u9:45 am,11:10 am, uTR
POL,347,, uThe American Court System, uTara Michelle  Costanzo, u7:10 pm,9:55 pm, uW
POL,349,, uEnvironmental Policy, uJohn L  Shurts, u4:10 pm,6:55 pm, uR
POL,373,, uPolitics of Latin America, uClaude   Pomerleau, u12:55 pm,2:20 pm, uTR
POL,391,, uImmigration in the US, uLara-Zuzan   Golesorkhi, u12:30 pm,1:25 pm, uMWF
POL,415,, uCongress and the Legislative Process, uGary L  Malecha, u4:10 pm,6:55 pm, uT
POL,457,, uThe Rise of China, uJeffrey W  Meiser, u2:40 pm,4:00 pm, uMW
PSY,101,uGeneral Psychology, uDeirdre Ann  Katz, u2:30 pm,3:55 pm, uTR
PSY,101,, uGeneral Psychology, uSarina Rodrigues  Saturn, u10:20 am,11:15 am, uMWF
PSY,101,, uGeneral Psychology, uAndrew M  Guest, u1:35 pm,2:30 pm, uMWF
PSY,101,, uGeneral Psychology, uTobias   Ryan, u8:10 am,9:35 am, uTR
PSY,101,, uGeneral Psychology, uNa Yung   Yu, u9:45 am,11:10 am, uTR
PSY,101,, uGeneral Psychology, uNa Yung   Yu, u11:20 am,12:45 pm, uTR
PSY,101,, uGeneral Psychology, uLouisa   Egan Brad, u12:55 pm,2:20 pm, uTR
PSY,101,, uGeneral Psychology, uJustin Daniel  Caouette, u2:30 pm,3:55 pm, uTR
PSY,214,, uResearch Methods: Design, uMartin A  Monto, u9:15 am,10:10 am, uMWF
PSY,214,, uResearch Methods: Design, uDeana Lynette  Julka, u9:45 am,11:10 am, uTR
PSY,215,, uResearch Methods: Analysis, uJoseph N  McRee, u12:55 pm,2:20 pm, uTR
PSY,310,, uBehavioral Neuroscience, uKathryn Grace  Wallin, u7:10 pm,9:55 pm, uM
PSY,315,, uEvolutionary Psychology, uZachary Lee  Simmons, u4:10 pm,6:55 pm, uR
PSY,320,, uPsychology of Learning, uSarina Rodrigues  Saturn, u2:40 pm,4:00 pm, uMW
PSY,320,, uPsychology of Learning, uSarina Rodrigues  Saturn, u4:10 pm,5:35 pm, uMW
PSY,330,, uCognition, uLouisa   Egan Brad, u2:30 pm,3:55 pm, uTR
PSY,350,, uSocial Psychology, uDeana Lynette  Julka, u11:20 am,12:45 pm, uTR
PSY,360,, uLife Span Development, uDeirdre Ann  Katz, u9:45 am,11:10 am, uTR
PSY,370,, uPersonality, uGregory A  May, u4:10 pm,6:55 pm, uR
PSY,373,, uPositive Psychology, uGregory A  May, u7:10 pm,9:55 pm, uR
PSY,380,, uAbnormal Psychology, uKevin James  Ashworth, u4:10 pm,6:55 pm, uW
PSY,392,, uMotivation and Emotion, uKathleen Cameron  McCulloch, u1:35 pm,2:30 pm, uMWF
PSY,392,, uPsychological Anthropology, uJason   Hopper, u7:10 pm,9:55 pm, uW
PSY,398,, uJunior Seminar, uAndrew M  Guest, u11:25 am,12:20 pm, uM
PSY,410,, uDrugs and Behavior, uMilky   Kohno, u4:10 pm,6:55 pm, uT
PSY,432,, uPsychology of Negotiations, uLouisa   Egan Brad, u7:10 pm,9:55 pm, uT
PSY,465,, uLiving with Grief Dying and Death, uAnissa Taun  Rogers, u9:45 am,11:10 am, uTR
PSY,480,, uClinical and Counseling Psychology, uAndrew M  Downs, u12:55 pm,2:20 pm, uTR
PSY,497,, uInternship, uGianna   Russo-Mitma, u4:10 pm,6:55 pm, uR
PSY,498A,, uSenior Capstone: Applied Projects, uAndrew M  Guest, u7:10 pm,9:55 pm, uT
PSY,498S,, uSenior Capstone: Seminar, uDeana Lynette  Julka, u4:10 pm,6:55 pm, uR
SW,205,uSocial Welfare and Social Justice, uBrigitte   Rodriguez, u4:10 pm,6:55 pm, uT
SW,205,, uSocial Welfare and Social Justice, uBobby Ali  Zaman, u4:10 pm,6:55 pm, uR
SW,214,, uResearch Methods: Design, uMartin A  Monto, u9:15 am,10:10 am, uMWF
SW,214,, uResearch Methods: Design, uDeana Lynette  Julka, u9:45 am,11:10 am, uTR
SW,313,, uSocial Welfare Policy, uAlice B.  Gates, u2:40 pm,4:00 pm, uMW
SW,357,, uPerspectives on Gender and the Body, uBobby Ali  Zaman, u7:10 pm,9:55 pm, uT
SW,386,, uInterviewing and Counseling, uKevin Richard  Jones, u4:10 pm,5:35 pm, uMW
SW,460,, uLocal and Global Social Justice Practice, uAlice B.  Gates, u4:10 pm,6:55 pm, uW
SW,465,, uLIving with Grief Dying and Death, uAnissa Taun  Rogers, u9:45 am,11:10 am, uTR
SW,481,, uTheory and Methods of Social Work Practice II, uAlice B.  Gates, u4:10 pm,6:55 pm, uM
SW,483,, uSocial Work Practicum II, uKevin Richard  Jones, u4:10 pm,6:55 pm, uT
SW,497,, uInternship, uGianna   Russo-Mitma, u4:10 pm,6:55 pm, uR
SOC,101,uIntroduction to Sociology, uBryan D  Rookey, u8:10 am,9:05 am, uMWF
SOC,101,, uIntroduction to Sociology, uBryan D  Rookey, u10:20 am,11:15 am, uMWF
SOC,101,, uIntroduction to Sociology, uMartin A  Monto, u10:20 am,11:15 am, uMWF
SOC,101,, uIntroduction to Sociology, uLauren Muriel  Alfrey, u8:10 am,9:35 am, uTR
SOC,101,, uIntroduction to Sociology, uNicole   Toussaint, u2:30 pm,3:55 pm, uTR
SOC,101,, uIntroduction to Sociology, uNicole   Toussaint, u4:10 pm,5:35 pm, uTR
SOC,101,, uIntroduction to Sociology, uElizabeth Melissa  Withers, u8:10 am,9:35 am, uTR
SOC,101,, uIntroduction to Sociology, uMychel   Estevez, u2:40 pm,4:00 pm, uMW
SOC,214,, uResearch Methods: Design, uMartin A  Monto, u9:15 am,10:10 am, uMWF
SOC,214,, uResearch Methods: Design, uDeana Lynette  Julka, u9:45 am,11:10 am, uTR
SOC,215,, uResearch Methods: Analysis, uJoseph N  McRee, u12:55 pm,2:20 pm, uTR
SOC,305,, uSociology of Crime and Justice, uJoseph N  McRee, u4:10 pm,6:55 pm, uT
SOC,336,, uRace and Racism in the United States, uLauren Muriel  Alfrey, u4:10 pm,6:55 pm, uW
SOC,339,, uSociology of the Family, uLauren Muriel  Alfrey, u12:55 pm,2:20 pm, uTR
SOC,350,, uSocial Psychology, uDeana Lynette  Julka, u11:20 am,12:45 pm, uTR
SOC,357,, uPerspectives on Gender and the Body, uBobby Ali  Zaman, u7:10 pm,9:55 pm, uT
SOC,380,, uSociological Theory, uMartin A  Monto, u11:20 am,12:45 pm, uTR
SOC,392,, uPsychological Anthropology, uJason   Hopper, u7:10 pm,9:55 pm, uW
SOC,431,, uMapping Social Problems, uBryan D  Rookey, u9:45 am,11:10 am, uTR
SOC,497,, uInternship, uGianna   Russo-Mitma, u4:10 pm,6:55 pm, uR
SOC,497C,, uCriminology Internship, uGianna   Russo-Mitma, u4:10 pm,6:55 pm, uR
SPN,102,uElementary Spanish, uAndrea M  Castanette, u8:10 am,9:05 am, uMWF
SPN,102,, uElementary Spanish, uAndrea M  Castanette, u9:15 am,10:10 am, uMWF
SPN,102,, uElementary Spanish, uFationa   Aliaj, u1:35 pm,2:30 pm, uMWF
SPN,102,, uElementary Spanish, uTraci Helen  Schick, u2:40 pm,3:35 pm, uMWF
SPN,181,, uMaximizing Stuyd Abroad, uJeffrey S  White, u8:10 am,9:05 am, uR
SPN,202,, uIntermediate Spanish, uElizabeth A  Giannone, u8:10 am,9:05 am, uMWF
SPN,202,, uIntermediate Spanish, uLora L  Looney, u9:15 am,10:10 am, uMWF
SPN,202,, uIntermediate Spanish, uLora L  Looney, u10:20 am,11:15 am, uMWF
SPN,202,, uIntermediate Spanish, uAndrea M  Castanette, u12:30 pm,1:25 pm, uMWF
SPN,202,, uIntermediate Spanish, uAndrea M  Castanette, u1:35 pm,2:30 pm, uMWF
SPN,202,, uIntermediate Spanish, uGiannina   Reyes-Giardiello, u1:35 pm,2:30 pm, uMWF
SPN,202,, uIntermediate Spanish, uGiannina   Reyes-Giardiello, u12:30 pm,1:25 pm, uMWF
SPN,302,, uAdvanced Spanish Composition Conversation and Culture II, uMatthew D.  Warshawsky, u11:20 am,12:45 pm, uTR
SPN,302,, uAdvanced Spanish Composition Conversation and Culture II, uMaria Elva  Echenique, u12:30 pm,1:25 pm, uMWF
SPN,302,, uAdvanced Spanish Composition Conversation and Culture II, uMaria Elva  Echenique, u1:35 pm,2:30 pm, uMWF
SPN,302,, uAdvanced Spanish Composition Conversation and Culture II, uMarcela C  Cinta, u12:55 pm,2:20 pm, uTR
SPN,330,, uThe Three Cultures of Medieval Spain, uMatthew D.  Warshawsky, u2:40 pm,4:00 pm, uMW
SPN,341,, uTwenty-First Century Spanish Literature, uLora L  Looney, u9:45 am,11:10 am, uTR
SPN,361,, uLatin American Short Story, uMaria Elva  Echenique, u4:10 pm,5:35 pm, uMW
SPN,361H,, uLatin American Short Story (Honors), uMaria Elva  Echenique, u4:10 pm,5:35 pm, uMW
SPN,380,, uLatino Social and Health Issues, uMarcela C  Cinta, u4:10 pm,6:55 pm, uT
SPN,451,, uSurvey of Latin American Literature and Civilization, uGiannina   Reyes-Giardiello, u7:10 pm,9:55 pm, uT
SPN,480,, uMedical Translation and Interpretation, uMarcela C  Cinta, u4:10 pm,6:55 pm, uM
SPN,480,, uMedical Translation and Interpretation, uMarcela C  Cinta, u2:30 pm,3:55 pm, uTR
SPN,497I,, uSpanish Internship, uJennifer   Hensley, u5:45 pm,6:55 pm, uM
SPN,497I,, uSpanish Internship, uJeffrey S  White, u5:45 pm,6:55 pm, uW
THTR,307,, uSurvey of Theatre History, uMead K  Hunter, u12:55 pm,2:20 pm, uTR
THTR,325,, uActing for Non-Majors, uMichelle   Seaton, u4:10 pm,5:35 pm, uTR
THTR,325,, uActing for Non-Majors, uMichelle   Seaton, u4:10 pm,5:35 pm, uMW
THTR,333,, uDirecting for Theatre, uAndrew W  Golla, u11:20 am,12:45 pm, uTR
THTR,335,, uVoice for the Stage, uCaren   Graham, u11:20 am,12:45 pm, uTR
THTR,337,, uStage Movement and Combat, uElizabeth G  Rothan, u2:30 pm,3:55 pm, uTR
THTR,350,, uTheatre Crafts, uEric Raymond  Lyness, u2:30 pm,3:55 pm, uTR
THTR,350,, uTheatre Crafts, uSusan L  Bonde, u2:30 pm,3:55 pm, uTR
THTR,351,, uBeginning Stage Lighting and Sound, uLawrence S  Larsen, u12:30 pm,1:15 pm, uMWF
THTR,365,, uStage Make Up, uGregory L  Pulver, u11:20 am,12:45 pm, uTR
THTR,391,, uEnsemble Created Theater, uAndrew W  Golla, u12:55 pm,2:20 pm, uTR
THTR,400,, uDramaturgy, uMead K  Hunter, u4:10 pm,5:35 pm, uMW
THTR,451,, uAdvanced Stage Lighting and Sound, uHarold   Logan, u4:10 pm,5:35 pm, uTR
THTR,471,, uTheater Management, uCarol Ann  Wohlmut, u4:10 pm,6:55 pm, uM
THTR,507,, uSurvey of Theatre History, uMead K  Hunter, u12:55 pm,2:20 pm, uTR
THTR,531,, uAdvanced Production Seminar, uLawrence S  Larsen, u4:10 pm,6:55 pm, uR
THEP,391,uHeat Hunger and Hurricanes, uCarol J  Dempsey, u4:10 pm,6:55 pm, uT
THE,024,uThe Character Project Discussion Group, uMark L  Poorman, u4:10 pm,6:55 pm, uM
THE,024,, uThe Character Project Discussion Group, uMark L  Poorman, u4:10 pm,6:55 pm, uM
THE,024,, uThe Character Project Discussion Group, uMark L  Poorman, u4:10 pm,6:55 pm, uM
THE,048,, uSuffering & Death: Discussion Group, uRebecca J  Gaudino, u5:45 pm,8:30 pm, uR
THE,048,, uSuffering & Death: Discussion Group, uRebecca J  Gaudino, u5:45 pm,8:30 pm, uR
THE,048,, uSuffering & Death: Discussion Group, uRebecca J  Gaudino, u5:45 pm,8:30 pm, uR
THE,048,, uSuffering & Death: Discussion Group, uRebecca J  Gaudino, u5:45 pm,8:30 pm, uR
THE,048,, uSuffering & Death: Discussion Group, uRebecca J  Gaudino, u5:45 pm,8:30 pm, uR
THE,048,, uSuffering & Death: Discussion Group, uRebecca J  Gaudino, u5:45 pm,8:30 pm, uR
THE,048,, uSuffering & Death: Discussion Group, uRebecca J  Gaudino, u5:45 pm,8:30 pm, uR
THE,105,, uIntroduction to Theology, uSimonMary Asese  Aihiokhai, u8:10 am,9:05 am, uMWF
THE,105,, uIntroduction to Theology, uSimonMary Asese  Aihiokhai, u9:15 am,10:10 am, uMWF
THE,105,, uIntroduction to Theology, uNina Sergeyevna  Henrichs-Tarasenkova, u10:20 am,11:15 am, uMWF
THE,105,, uIntroduction to Theology, uGeorge A  Gray, u11:25 am,12:20 pm, uMWF
THE,105,, uIntroduction to Theology, uMichael Robert  Prendergast, u12:30 pm,1:25 pm, uMWF
THE,105,, uIntroduction to Theology, uGeorge A  Gray, u1:35 pm,2:30 pm, uMWF
THE,105,, uIntroduction to Theology, uNina Sergeyevna  Henrichs-Tarasenkova, u2:40 pm,4:00 pm, uMW
THE,105,, uIntroduction to Theology, uNina Sergeyevna  Henrichs-Tarasenkova, u4:10 pm,5:35 pm, uMW
THE,105,, uIntroduction to Theology, uJames Bernard  King, u9:45 am,11:10 am, uTR
THE,105,, uIntroduction to Theology, uRussell A  Butkus, u11:20 am,12:45 pm, uTR
THE,105,, uIntroduction to Theology, uDavid   Turnbloom, u11:20 am,12:45 pm, uTR
THE,105,, uIntroduction to Theology, uDavid   Turnbloom, u12:55 pm,2:20 pm, uTR
THE,105,, uIntroduction to Theology, uJames Bernard  King, u2:30 pm,3:55 pm, uTR
THE,105,, uIntroduction to Theology, uJonathan   Stanfill, u4:10 pm,5:35 pm, uTR
THE,105,, uIntroduction to Theology, uRussell A  Butkus, u4:10 pm,6:55 pm, uW
THE,105,, uIntroduction to Theology, uJames Bernard  King, u8:10 am,9:30 am, uTR
THE,105,, uIntroduction to Theology, uJonathan   Stanfill, u2:30 pm,3:55 pm, uTR
THE,205,, uThe Bible Past and Present, uGeorge A  Gray, u8:10 am,9:05 am, uMWF
THE,205,, uThe Bible Past and Present, uGeorge A  Gray, u9:15 am,10:10 am, uMWF
THE,205,, uThe Bible Past and Present, uCarol J  Dempsey, u10:20 am,11:15 am, uMWF
THE,205,, uThe Bible Past and Present, uCarol J  Dempsey, u11:25 am,12:20 pm, uMWF
THE,205,, uThe Bible Past and Present, uJennifer Grace  Bird, u12:30 pm,1:25 pm, uMWF
THE,205,, uThe Bible Past and Present, uJennifer Grace  Bird, u1:35 pm,2:30 pm, uMWF
THE,205,, uThe Bible Past and Present, uRebecca J  Gaudino, u2:40 pm,4:00 pm, uMW
THE,205,, uThe Bible Past and Present, uRachel J  Wheeler, u8:10 am,9:35 am, uTR
THE,205,, uThe Bible Past and Present, uWilloughby H  Deming, u9:45 am,11:10 am, uTR
THE,205,, uThe Bible Past and Present, uRebecca J  Gaudino, u11:20 am,12:45 pm, uTR
THE,205,, uThe Bible Past and Present, uWilloughby H  Deming, u12:55 pm,2:20 pm, uTR
THE,205,, uThe Bible Past and Present, uRachel J  Wheeler, u12:55 pm,2:20 pm, uTR
THE,205,, uThe Bible Past and Present, uGlenn Michael  Cameron, u4:10 pm,5:35 pm, uTR
THE,205,, uThe Bible Past and Present, uJonathan   Stanfill, u7:10 pm,8:35 pm, uMW
THE,305,, uComparing Religions of the World, uWilloughby H  Deming, u2:40 pm,4:00 pm, uMW
THE,320,, uChristian Personal Values, uMatthew J  Baasten, u4:10 pm,6:55 pm, uW
THE,324,, uThe Character Project, uMark L  Poorman, u4:10 pm,6:55 pm, uM
THE,329,, uTheological Bioethics, uChristina Alabanza  Astorga, u4:10 pm,5:35 pm, uTR
THE,336,, uLiturgy and Ethics, uDavid   Turnbloom, u4:10 pm,5:35 pm, uMW
THE,342,, uIntroduction to Christian Spirituality, uRachel J  Wheeler, u9:45 am,11:10 am, uTR
THE,347,, uTheological Reflection Seminar, uVeronicca M  Bathon, u7:10 pm,8:10 pm, uM
THE,348,, uTheological Dimensions of Suffering and Death, uRebecca J  Gaudino, u5:45 pm,8:30 pm, uR
THE,353,, uReligion and Science, uJames   Slagle, u11:20 am,12:45 pm, uTR
THE,353,, uReligion and Science, uJames   Slagle, u12:55 pm,2:20 pm, uTR
THE,359,, uTheological Themes in Catholic Literature, uCharles B  Gordon, u8:10 am,9:35 am, uTR
THE,363,, uSaint Augustine Teacher of Christianity, uGlenn Michael  Cameron, u2:40 pm,4:00 pm, uMW
THE,391,, uGod Our Mother: Biblical Imagery of the Divine Female, uNina Sergeyevna  Henrichs-Tarasenkova, u7:10 pm,8:35 pm, uMW
THE,391,, uRace and Ethnicity in Ancient Christianity, uJonathan   Stanfill, u7:10 pm,9:55 pm, uT
THE,391,, uGender Violence Gender Inequity and Gender Resistance, uChristina Alabanza  Astorga, u4:10 pm,6:55 pm, uW
THE,391,, uTheologies of Encounter: Christianity Encountering Other Religions, uSimonMary Asese  Aihiokhai, u1:35 pm,2:30 pm, uMWF
THE,405,, uComparing Religions of the World, uWilloughby H  Deming, u2:40 pm,4:00 pm, uMW
THE,420,, uChristian Personal Values, uMatthew J  Baasten, u4:10 pm,6:55 pm, uW
THE,424,, uThe Character Project, uMark L  Poorman, u4:10 pm,6:55 pm, uM
THE,429,, uTheological Bioethics, uChristina Alabanza  Astorga, u4:10 pm,5:35 pm, uTR
THE,436,, uLiturgy and Ethics, uDavid   Turnbloom, u4:10 pm,5:35 pm, uMW
THE,442,, uIntroduction to Christian Spirituality, uRachel J  Wheeler, u9:45 am,11:10 am, uTR
THE,453,, uReligion and Science, uJames   Slagle, u11:20 am,12:45 pm, uTR
THE,453,, uReligion and Science, uJames   Slagle, u12:55 pm,2:20 pm, uTR
THE,459,, uTheological Themes in Catholic Literature, uCharles B  Gordon, u8:10 am,9:35 am, uTR
THE,463,, uSaint Augustine Teacher of Christianity, uGlenn Michael  Cameron, u2:40 pm,4:00 pm, uMW
THE,491,, uGod Our Mother: Biblical Imagery of the Divine Female, uNina Sergeyevna  Henrichs-Tarasenkova, u7:10 pm,8:35 pm, uMW
THE,491,, uRace and Ethnicity in Ancient Christianity, uJonathan   Stanfill, u7:10 pm,9:55 pm, uT
THE,491,, uGender Violence Gender Inequity and Gender Resistance, uChristina Alabanza  Astorga, u4:10 pm,6:55 pm, uW
THE,491,, uTheologies of Encounter: Christianity Encountering Other Religions, uSimonMary Asese  Aihiokhai, u1:35 pm,2:30 pm, uMWF
