AS,001,uAir Force ROTC Physical Training, uJohn David Anthony  Gasa, u6:30 am,7:30 am, uM
AS,002,, uAir Force ROTC Physical Training 2, uJohn David Anthony  Gasa, u6:30 am,7:30 am, uM
AS,003,, uAir Force ROTC Physical Training 3, uJohn David Anthony  Gasa, u6:30 am,7:30 am, uM
AS,004,, uAir Force ROTC Physical Training 4, uJohn David Anthony  Gasa, u6:30 am,7:30 am, uM
AS,005,, uAir Force ROTC Physical Training, uJohn David Anthony  Gasa, u6:30 am,7:30 am, uM
AS,102,, uFoundations of The U.S. Air Force, uJohn David Anthony  Gasa, u10:00 am,11:30 am, uT
AS,102,, uFoundations of The U.S. Air Force, uBryan Richard  Scism, u2:00 pm,3:30 pm, uT
AS,112,, uLeadership Laboratory, uJohn David Anthony  Gasa, u4:10 pm,6:00 pm, uT
AS,202,, uThe Evaluation of USAF Air & Space Power, uLarry B  Ingersoll, u8:00 am,9:30 am, uT
AS,202,, uThe Evaluation of USAF Air & Space Power, uJohn David Anthony  Gasa, u12:00 pm,1:30 pm, uT
AS,212,, uLeadership Laboratory, uJohn David Anthony  Gasa, u4:10 pm,6:00 pm, uT
AS,302,, uLeadership & Management, uDrew Marie  Lindley, u8:00 am,9:30 am, uTR
AS,312,, uLeadership Laboratory, uJohn David Anthony  Gasa, u4:10 pm,6:00 pm, uT
AS,402,, uNational Security Affairs & Preparation for Active Duty, uJohn David Anthony  Gasa, u7:00 am,8:30 am, uTW
AS,412,, uLeadership Laboratory, uJohn David Anthony  Gasa, u4:10 pm,6:00 pm, uT
AS,415,, uLeadership Laboratory, uJohn David Anthony  Gasa, u4:10 pm,6:00 pm, uT
BIO,005,uBIO 205 Workshop, uAmy S  Beadles-Bohling, u4:50 pm,5:50 pm, uM
BIO,005,, uBIO 205 Workshop, uAmy S  Beadles-Bohling, u6:00 pm,7:00 pm, uM
BIO,005,, uBIO 205 Workshop, uAmy S  Beadles-Bohling, u4:50 pm,5:50 pm, uT
BIO,005,, uBIO 205 Workshop, uAmy S  Beadles-Bohling, u6:00 pm,7:00 pm, uT
BIO,005,, uBIO 205 Workshop, uAmy S  Beadles-Bohling, u4:50 pm,5:50 pm, uM
BIO,005,, uBIO 205 Workshop, uAmy S  Beadles-Bohling, u4:50 pm,5:50 pm, uT
BIO,005,, uBIO 205 Workshop, uAmy S  Beadles-Bohling, u6:00 pm,7:00 pm, uM
BIO,005,, uBIO 205 Workshop, uAmy S  Beadles-Bohling, u6:00 pm,7:00 pm, uT
BIO,203,, uHuman Form and Function, uRobert Louis  Hesslink Jr, u4:10 pm,5:35 pm, uTR
BIO,205,, uFoundations of Biology, uAmy S  Beadles-Bohling, u9:15 am,10:10 am, uMWF
BIO,205,, uFoundations of Biology, uAmy S  Beadles-Bohling, u11:25 am,12:20 pm, uMWF
BIO,207,, uIntroduction to Molecular and Cellular Biology, uDavid   Wynne, u8:10 am,9:05 am, uMWF
BIO,207,, uIntroduction to Molecular and Cellular Biology, uAdrienne A  Greaves, u10:20 am,11:15 am, uMWF
BIO,207,, uIntroduction to Molecular and Cellular Biology, uAdrienne A  Greaves, u11:25 am,12:20 pm, uMWF
BIO,208,, uIntroduction to Evolution and Ecology, uDavid W  Taylor, u10:20 am,11:15 am, uMWF
BIO,208,, uIntroduction to Evolution and Ecology, uDavid W  Taylor, u12:30 pm,1:25 pm, uMWF
BIO,208,, uIntroduction to Evolution and Ecology, uDavid W  Taylor, u1:35 pm,2:30 pm, uMWF
BIO,277,, uIntroduction to Molecular and Cellular Biology Laboratory, uDavid   Wynne, u8:10 am,11:10 am, uR
BIO,277,, uIntroduction to Molecular and Cellular Biology Laboratory, uDavid   Wynne, u12:55 pm,3:55 pm, uR
BIO,277,, uIntroduction to Molecular and Cellular Biology Laboratory, uSarah   Schmits, u5:10 pm,8:10 pm, uT
BIO,277,, uIntroduction to Molecular and Cellular Biology Laboratory, uAdrienne A  Greaves, u9:45 am,12:45 pm, uT
BIO,277,, uIntroduction to Molecular and Cellular Biology Laboratory, uAdrienne A  Greaves, u12:55 pm,3:55 pm, uT
BIO,278,, uIntroduction to Evolution and Ecology Laboratory, uLaurie J  Dizney, u1:35 pm,4:35 pm, uM
BIO,278,, uIntroduction to Evolution and Ecology Laboratory, uLaurie J  Dizney, u5:00 pm,8:00 pm, uM
BIO,278,, uIntroduction to Evolution and Ecology Laboratory, uLaurie J  Dizney, u9:45 am,12:45 pm, uT
BIO,278,, uIntroduction to Evolution and Ecology Laboratory, uLaurie J  Dizney, u9:45 am,12:45 pm, uR
BIO,301,, uMicrobiology, uDavid   Katz, u2:40 pm,3:35 pm, uMWF
BIO,304,, uWetlands Ecology, uChristine L  Weilhoefer, u9:45 am,11:10 am, uTR
BIO,305,, uHuman Anatomy and Physiology 1, uJulia Cleverly  Ruppell, u11:25 am,12:20 pm, uMWF
BIO,305,, uHuman Anatomy and Physiology 1, uJacqueline   Van Hoomissen, u9:45 am,11:10 am, uTR
BIO,305,, uHuman Anatomy and Physiology 1, uJonathan Edwin  Elliott, u11:20 am,12:45 pm, uTR
BIO,305,, uHuman Anatomy and Physiology 1, uJulia Cleverly  Ruppell, u12:30 pm,1:25 pm, uMWF
BIO,305,, uHuman Anatomy and Physiology 1, uDavid   Katz, u5:10 pm,6:35 pm, uMW
BIO,306,, uHuman Anatomy and Physiology 2, uKyle L  Flann, u8:10 am,9:05 am, uMWF
BIO,306,, uHuman Anatomy and Physiology 2, uAnthony   Drew, u6:10 pm,7:35 pm, uTR
BIO,306,, uHuman Anatomy and Physiology 2, uJohn M  White, u9:45 am,11:10 am, uTR
BIO,336,, uDevelopmental Biology, uLaura   Dyer, u9:15 am,10:10 am, uMWF
BIO,338,, uMarine Biology of the Pacific Northwest, uTara Elaine  Prestholdt, u11:20 am,12:45 pm, uTR
BIO,342,, uNeurobiology, uJonathan Edwin  Elliott, u2:30 pm,3:55 pm, uTR
BIO,345,, uVertebrate Biology, uKathleen M  OReilly , u11:25 am,12:20 pm, uMWF
BIO,348,, uConservation Biology, uLaurie J  Dizney, u12:55 pm,2:20 pm, uTR
BIO,348H,, uConservation Biology (Honors), uLaurie J  Dizney, u12:55 pm,2:20 pm, uTR
BIO,359,, uMicrobiology for Nurses, uPaula A.  Tower, u11:25 am,12:20 pm, uMWF
BIO,359,, uMicrobiology for Nurses, uPaula A.  Tower, u10:20 am,11:15 am, uMWF
BIO,361,, uMicrobiology Lab, uDavid   Katz, u9:45 am,12:45 pm, uT
BIO,361,, uMicrobiology Lab, uDavid   Katz, u2:30 pm,5:30 pm, uT
BIO,365,, uHuman Anatomy & Physiology Lab 1, uPatrick Michael  Geraghty, u5:10 pm,8:10 pm, uM
BIO,365,, uHuman Anatomy & Physiology Lab 1, uJohn M  White, u9:15 am,12:15 pm, uM
BIO,365,, uHuman Anatomy & Physiology Lab 1, uKristin M   Carson, u5:10 pm,8:10 pm, uW
BIO,365,, uHuman Anatomy & Physiology Lab 1, uPatrick Michael  Geraghty, u1:35 pm,4:35 pm, uR
BIO,365,, uHuman Anatomy & Physiology Lab 1, uJonathan Edwin  Elliott, u1:35 pm,4:35 pm, uW
BIO,365,, uHuman Anatomy & Physiology Lab 1, uJohn M  White, u1:35 pm,4:35 pm, uM
BIO,365,, uHuman Anatomy & Physiology Lab 1, uBonnie Jean  Sumner, u9:15 am,12:15 pm, uW
BIO,365,, uHuman Anatomy & Physiology Lab 1, uBonnie Jean  Sumner, u9:15 am,12:15 pm, uF
BIO,365,, uHuman Anatomy & Physiology Lab 1, uJonathan Edwin  Elliott, u5:10 pm,8:10 pm, uR
BIO,366,, uHuman Anatomy & Physiology Lab 2, uKyle L  Flann, u9:15 am,12:15 pm, uM
BIO,366,, uHuman Anatomy & Physiology Lab 2, uAmy S  Beadles-Bohling, u1:35 pm,4:35 pm, uM
BIO,366,, uHuman Anatomy & Physiology Lab 2, uChristie Engesser  Cesar, u9:45 am,12:45 pm, uT
BIO,366,, uHuman Anatomy & Physiology Lab 2, uChristie Engesser  Cesar, u12:55 pm,3:55 pm, uT
BIO,366,, uHuman Anatomy & Physiology Lab 2, uKyle L  Flann, u9:15 am,12:15 pm, uW
BIO,366,, uHuman Anatomy & Physiology Lab 2, uJohn M  White, u12:30 pm,3:30 pm, uW
BIO,366,, uHuman Anatomy & Physiology Lab 2, uChristie Engesser  Cesar, u9:45 am,12:45 pm, uR
BIO,366,, uHuman Anatomy & Physiology Lab 2, uKyle L  Flann, u9:15 am,12:15 pm, uF
BIO,366,, uHuman Anatomy & Physiology Lab 2, uChristie Engesser  Cesar, u12:55 pm,3:55 pm, uR
BIO,368,, uMarine Biology Laboratory, uTara Elaine  Prestholdt, u1:35 pm,4:35 pm, uW
BIO,368,, uMarine Biology Laboratory, uTara Elaine  Prestholdt, u12:55 pm,3:55 pm, uR
BIO,374,, uWetlands Ecology Laboratory, uChristine L  Weilhoefer, u10:20 am,1:20 pm, uW
BIO,374,, uWetlands Ecology Laboratory, uChristine L  Weilhoefer, u1:35 pm,4:35 pm, uW
BIO,375,, uVertebrate Biology Laboratory, uKathleen M  OReilly , u1:35 pm,4:35 pm, uM
BIO,375,, uVertebrate Biology Laboratory, uKathleen M  OReilly , u12:55 pm,3:55 pm, uT
BIO,376,, uDevelopmental Biology Laboratory, uLaura   Dyer, u12:55 pm,3:55 pm, uW
BIO,376,, uDevelopmental Biology Laboratory, uLaura   Dyer, u12:55 pm,3:55 pm, uR
BIO,379,, uMicrobiology Lab for Nurses, uPriya   Mani, u9:45 am,12:45 pm, uR
BIO,379,, uMicrobiology Lab for Nurses, uPriya   Mani, u2:30 pm,5:30 pm, uR
BIO,379,, uMicrobiology Lab for Nurses, uPriya   Mani, u11:25 am,2:25 pm, uF
BIO,379,, uMicrobiology Lab for Nurses, uPriya   Mani, u1:35 pm,4:35 pm, uW
BIO,379,, uMicrobiology Lab for Nurses, uPriya   Mani, u5:10 pm,8:10 pm, uW
BIO,387,, uService Learning In Biology, uAmy S  Beadles-Bohling, u2:30 pm,3:45 pm, uR
BIO,400,, uImmunology, uSusan Elizabeth  Murray, u9:15 am,10:10 am, uMWF
BIO,400,, uImmunology, uSusan Elizabeth  Murray, u10:20 am,11:15 am, uMWF
BIO,453,, uEvolution, uAmelia J  Ahern-Rindell, u9:45 am,11:10 am, uTR
BIO,453,, uEvolution, uJulia Cleverly  Ruppell, u4:10 pm,6:55 pm, uW
BIO,453,, uEvolution, uAmelia J  Ahern-Rindell, u5:10 pm,8:10 pm, uM
BIO,470,, uImmunology Laboratory, uSusan Elizabeth  Murray, u12:55 pm,3:55 pm, uT
BIO,497I,, uOT/PT Internship, uElizabeth K.  Winegar, u6:00 pm,7:30 pm, uM
BME,200,uIntroduction to Biomedical Engineering, uKathleen   Bieryla, u9:15 am,10:10 am, uMWF
BME,562,, uBiomechanics, uJennifer Elaine  Symons, u4:10 pm,5:35 pm, uTR
BME,563,, uDigital Signal Processing, uJoseph P  Hoffbeck, u8:10 am,9:35 am, uTR
BME,578,, uManagement of Technology for Medical Devices, uPeter B  Rachor, u4:10 pm,6:55 pm, uW
BME,584,, uBiomedical Device Optimization, uKathleen   Bieryla, u11:20 am,12:45 pm, uTR
BUS,100,uIntroduction of Leadership Skills, uMontana   Hisel-Cochran, u11:20 am,12:45 pm, uTR
BUS,101,, uSoftware Applications Workshop, uRobert B  Stratton, u9:15 am,10:10 am, uM
BUS,101,, uSoftware Applications Workshop, uRobert B  Stratton, u10:20 am,11:15 am, uM
BUS,101,, uSoftware Applications Workshop, uRobert B  Stratton, u11:25 am,12:20 pm, uM
BUS,101,, uSoftware Applications Workshop, uRobert B  Stratton, u1:35 pm,2:30 pm, uM
BUS,150,, uSmart Money I, uC Christopher  Dunnaville, u10:20 am,11:15 am, uF
BUS,200,, uPrinciples of Marketing, uElena Kiryanova  Bernard, u2:30 pm,3:55 pm, uTR
BUS,200,, uPrinciples of Marketing, uTyler   Laird-Magee, u8:10 am,9:35 am, uTR
BUS,200,, uPrinciples of Marketing, uIan David  Parkman, u2:40 pm,3:35 pm, uMWF
BUS,202,, uProfessional Development, uGwendolyn Marie  Klobes, u2:40 pm,3:35 pm, uM
BUS,202,, uProfessional Development, uGwendolyn Marie  Klobes, u10:20 am,11:15 am, uW
BUS,202,, uProfessional Development, uGwendolyn Marie  Klobes, u2:40 pm,3:35 pm, uW
BUS,205,, uBusiness Finance, uMadhuparna   Kolay, u9:15 am,10:10 am, uMWF
BUS,205,, uBusiness Finance, uRichard D  Gritta, u9:15 am,10:10 am, uMWF
BUS,205,, uBusiness Finance, uC Christopher  Dunnaville, u11:25 am,12:20 pm, uMWF
BUS,205,, uBusiness Finance, uC Christopher  Dunnaville, u12:30 pm,1:25 pm, uMWF
BUS,209,, uFinancial Accounting, uEllen June  Lippman, u4:10 pm,6:55 pm, uW
BUS,209,, uFinancial Accounting, uLizhong   Hao, u12:55 pm,2:20 pm, uTR
BUS,209,, uFinancial Accounting, uLizhong   Hao, u2:30 pm,3:55 pm, uTR
BUS,210,, uManagerial Accounting, uEvelyn Claire  Costin, u9:45 am,11:10 am, uTR
BUS,210,, uManagerial Accounting, uEvelyn Claire  Costin, u11:20 am,12:45 pm, uTR
BUS,210,, uManagerial Accounting, uHenghsiu   Lin, u12:55 pm,2:20 pm, uTR
BUS,210,, uManagerial Accounting, uHenghsiu   Lin, u2:30 pm,3:55 pm, uTR
BUS,250,, uLegal and Social Responsibility in Business, uBarbara Ann  Bloom-Groshong, u9:45 am,11:10 am, uTR
BUS,250,, uLegal and Social Responsibility in Business, uBarbara Ann  Bloom-Groshong, u12:55 pm,2:20 pm, uTR
BUS,250,, uLegal and Social Responsibility in Business, uBarbara Ann  Bloom-Groshong, u2:30 pm,3:55 pm, uTR
BUS,255,, uIntroduction to Operations & Technology Management, uNaveen   Gudigantala, u9:15 am,10:10 am, uMWF
BUS,255,, uIntroduction to Operations & Technology Management, uWilfred W  Wu, u1:35 pm,2:30 pm, uMWF
BUS,255,, uIntroduction to Operations & Technology Management, uWilfred W  Wu, u2:40 pm,3:35 pm, uMWF
BUS,302,, uInternship Preparation, uMontana   Hisel-Cochran, u9:15 am,10:10 am, uM
BUS,302,, uInternship Preparation, uMontana   Hisel-Cochran, u10:20 am,11:15 am, uM
BUS,311,, uIntermediate Accounting II, uEllen June  Lippman, u4:10 pm,5:35 pm, uTR
BUS,311,, uIntermediate Accounting II, uEllen June  Lippman, u5:45 pm,7:05 pm, uTR
BUS,312,, uCost Accounting, uLizhong   Hao, u9:45 am,11:10 am, uTR
BUS,330,, uManagerial Finance, uMadhuparna   Kolay, u10:20 am,11:15 am, uMWF
BUS,355,, uDecision Modeling, uMin   Yu, u12:30 pm,1:25 pm, uMWF
BUS,355,, uDecision Modeling, uMin   Yu, u2:40 pm,3:35 pm, uMWF
BUS,355,, uDecision Modeling, uEvelyn Claire  Costin, u2:30 pm,3:55 pm, uTR
BUS,360,, uCross Cultural Organizational Behavior and Ethics, uDaniel J  Parrish, u9:45 am,11:10 am, uTR
BUS,360,, uCross Cultural Organizational Behavior and Ethics, uDaniel J  Parrish, u11:20 am,12:45 pm, uTR
BUS,360,, uCross Cultural Organizational Behavior and Ethics, uDaniel J  Parrish, u2:30 pm,3:55 pm, uTR
BUS,361,, uFoundations of Operations Management, uJoshua Stephen  Grover, u7:10 pm,9:55 pm, uT
BUS,364,, uInnovation, uJonathan Taylor  Down, u8:10 am,9:05 am, uMWF
BUS,364,, uInnovation, uBeatriz Itzel   Cruz Megchun, u9:15 am,10:10 am, uMWF
BUS,364,, uInnovation, uBeatriz Itzel   Cruz Megchun, u10:20 am,11:15 am, uMWF
BUS,364,, uInnovation, uJonathan Taylor  Down, u12:30 pm,1:25 pm, uMWF
BUS,371,, uConsumer Behavior, uDebra Lynn  Stephens, u10:20 am,11:15 am, uMWF
BUS,371,, uConsumer Behavior, uDebra Lynn  Stephens, u11:25 am,12:20 pm, uMWF
BUS,371,, uConsumer Behavior, uDebra Lynn  Stephens, u1:35 pm,2:30 pm, uMWF
BUS,371H,, uConsumer Behavior (Honors), uDebra Lynn  Stephens, u11:25 am,12:20 pm, uMWF
BUS,385,, uOpportunity Assessment, uJonathan Taylor  Down, u4:10 pm,6:55 pm, uR
BUS,400,, uManagement Decisions and Policy, uSamuel Scott  Holloway, u11:25 am,12:20 pm, uMWF
BUS,400,, uManagement Decisions and Policy, uSamuel Scott  Holloway, u1:35 pm,2:30 pm, uMWF
BUS,408,, uInnovation for Sustainability, uGregory M  Hill, u7:10 pm,9:55 pm, uW
BUS,430,, uInvestments, uRichard D  Gritta, u1:35 pm,2:30 pm, uMWF
BUS,431,, uFinancial Markets and Institutions, uBrian J.  Adams, u7:10 pm,9:55 pm, uR
BUS,432,, uPersonal Financial Planning, uC Christopher  Dunnaville, u8:10 am,9:05 am, uMWF
BUS,441,, uInternational Finance, uArjun   Chatrath, u4:10 pm,5:35 pm, uTR
BUS,443,, uInternational Marketing Management, uTyler   Laird-Magee, u2:30 pm,3:55 pm, uTR
BUS,450,, uAdvanced Business Law, uBarbara Ann  Bloom-Groshong, u8:10 am,9:05 am, uMWF
BUS,452,, uProject Management, uGary F  Mitchell, u11:20 am,12:45 pm, uTR
BUS,452,, uProject Management, uGary F  Mitchell, u12:55 pm,2:20 pm, uTR
BUS,456,, uSystems Analysis and Design, uTae-In   Eom, u9:45 am,11:10 am, uTR
BUS,456,, uSystems Analysis and Design, uTae-In   Eom, u7:10 pm,9:55 pm, uR
BUS,459,, uBusiness Analytics, uNaveen   Gudigantala, u11:25 am,12:20 pm, uMWF
BUS,464,, uBusiness Taxation, uJames John  Jurinski, u2:40 pm,3:35 pm, uMWF
BUS,465,, uAuditing, uTeri O  Grimmer, u4:10 pm,6:55 pm, uW
BUS,466,, uAdvanced Accounting II, uHenghsiu   Lin, u9:45 am,11:10 am, uTR
BUS,468,, uApplied Portfolio Management, uBrian J.  Adams, u7:10 pm,9:55 pm, uT
BUS,471,, uBrand Promotions Management, uTyler   Laird-Magee, u12:55 pm,2:20 pm, uTR
BUS,474,, uDigital Marketing, uElena Kiryanova  Bernard, u4:10 pm,5:35 pm, uTR
BUS,476,, uProduct Design & Development, uIan David  Parkman, u4:10 pm,5:35 pm, uMW
BUS,483,, uStrategic Controls for New Venture Operations, uMark R  Meckler, u7:10 pm,9:55 pm, uR
BUS,486,, uVenture Launch, uJonathan Taylor  Down, u2:40 pm,3:35 pm, uMWF
BUS,487,, uSocial Entrepreneurship, uPeter B  Rachor, u7:10 pm,9:55 pm, uT
BUS,491,, uAccounting Ethics, uJames John  Jurinski, u4:10 pm,6:55 pm, uM
BUS,491,, uDesign Thinking, uBeatriz Itzel   Cruz Megchun, u7:10 pm,9:55 pm, uW
BUS,491,, uProduction and Service Operations Management, uMin   Yu, u4:10 pm,6:55 pm, uW
BUS,491,, uWebsite Marketing, uElena Kiryanova  Bernard, u11:20 am,12:45 pm, uTR
BUS,491,, uAccounting Analytics, uTeri O  Grimmer, u1:35 pm,2:30 pm, uMWF
BUS,491,, uComputing Concepts and Programming, uBenjamin Raymond  Tribelhorn, u9:15 am,10:10 am, uMWF
BUS,491,, uMarketing Operations, uJoseph Essa  Barhoum, u7:10 pm,9:55 pm, uR
BUS,491,, uReal Estate Law, uJames John  Jurinski, u7:10 pm,9:55 pm, uW
BUS,501,, uEconomic Analysis, uBahram   Adrangi, u7:10 pm,9:55 pm, uT
BUS,505,, uIntroduction to Operations & Technology  Management, uTimothy Dean  Larson, u7:10 pm,9:55 pm, uT
BUS,506,, uPrinciples of Accounting, uTeri O  Grimmer, u4:10 pm,6:55 pm, uM
BUS,510,, uEconomics and Metrics for Sustainability, uWilliam F  Barnes, u7:10 pm,9:55 pm, uW
BUS,511,, uCross-Cultural Management, uSamuel Scott  Holloway, u7:10 pm,9:55 pm, uM
BUS,515,, uSocial Venture Management, uShari Lynette  Dunn, u7:10 pm,9:55 pm, uM
BUS,520,, uApplied Marketing Strategies, uIan David  Parkman, u7:10 pm,9:55 pm, uM
BUS,524,, uBrand Promotions Management, uTyler   Laird-Magee, u4:10 pm,6:55 pm, uT
BUS,528,, uSports Marketing, uAlison J  Sarantakos, u7:10 pm,9:55 pm, uR
BUS,530,, uCorporate Finance, uArjun   Chatrath, u7:10 pm,9:55 pm, uR
BUS,531,, uInternational Finance, uArjun   Chatrath, u7:10 pm,9:55 pm, uT
BUS,532,, uSecurity and Portfolio Analysis, uRichard D  Gritta, u7:10 pm,9:55 pm, uM
BUS,539,, uResearch Methods in Finance, uMadhuparna   Kolay, u4:10 pm,6:55 pm, uM
BUS,540,, uProcess Analysis & Quality Management, uWilfred W  Wu, u7:10 pm,9:55 pm, uM
BUS,541,, uHuman Resource Management, uAlan Paul  Huston, u7:10 pm,9:55 pm, uM
BUS,542,, uSystems Analysis and Design, uTae-In   Eom, u7:10 pm,9:55 pm, uT
BUS,545,, uProject Management, uGary F  Mitchell, u7:10 pm,9:55 pm, uW
BUS,565,, uAuditing, uTeri O  Grimmer, u4:10 pm,6:55 pm, uW
BUS,566,, uAdvanced Accounting, uHenghsiu   Lin, u9:45 am,11:10 am, uTR
BUS,578,, uManagement of Technology for Life Science, uPeter B  Rachor, u4:10 pm,6:55 pm, uW
BUS,580,, uStrategic Issues and Applications in Management, uMark R  Meckler, u7:10 pm,9:55 pm, uW
BUS,591,, uIT Security, uScott David  Fenton, u7:10 pm,9:55 pm, uR
BUS,591,, uProduction and Service Operations Management, uMin   Yu, u4:10 pm,6:55 pm, uW
BUS,591,, uReal Estate Law, uJames John  Jurinski, u7:10 pm,9:55 pm, uW
BUS,591,, uStrategy and Competition in the Experiential Economy, uSamuel Scott  Holloway, u4:10 pm,6:55 pm, uR
BUS,591,, uMarketing Operations, uJoseph Essa  Barhoum, u7:10 pm,9:55 pm, uR
BUS,912,, uTax: Persons/Property/Entities, uJames John  Jurinski, u6:00 pm,9:35 pm, uF
BUS,913,, uRetirement/Employee Benefits, uC Christopher  Dunnaville, u6:00 pm,9:35 pm, uF
BUS,914,, uEstate Tax Planning, uTheodore B  Austin, u6:00 pm,6:55 pm, uF
BUS,915,, uCases in Financial Planning, uBruce E  Miller, u6:00 pm,9:35 pm, uF
CHM,007,uGeneral Chemistry I Workshop, uAngela   Hoffman, u4:10 pm,5:35 pm, uM
CHM,007,, uGeneral Chemistry I Workshop, uAngela   Hoffman, u7:10 pm,8:35 pm, uM
CHM,007,, uGeneral Chemistry I Workshop, uAngela   Hoffman, u5:40 pm,7:05 pm, uT
CHM,007,, uGeneral Chemistry I Workshop, uElizabeth Ruth  Morton, u5:40 pm,7:05 pm, uW
CHM,007,, uGeneral Chemistry I Workshop, uElizabeth Ruth  Morton, u7:10 pm,8:35 pm, uW
CHM,007,, uGeneral Chemistry I Workshop, uElizabeth Ruth  Morton, u4:10 pm,5:35 pm, uT
CHM,007,, uGeneral Chemistry I Workshop, uElizabeth Ruth  Morton, u4:10 pm,5:35 pm, uW
CHM,007,, uGeneral Chemistry I Workshop, uRachel   Hutcheson, u4:10 pm,5:35 pm, uM
CHM,007,, uGeneral Chemistry I Workshop, uRachel   Hutcheson, u7:10 pm,8:35 pm, uM
CHM,007,, uGeneral Chemistry I Workshop, uRachel   Hutcheson, u5:40 pm,7:05 pm, uT
CHM,007,, uGeneral Chemistry I Workshop, uRachel   Hutcheson, u7:10 pm,8:35 pm, uT
CHM,007,, uGeneral Chemistry I Workshop, uEdward J  Valente, u5:40 pm,7:05 pm, uM
CHM,007,, uGeneral Chemistry I Workshop, uEdward J  Valente, u7:10 pm,8:35 pm, uM
CHM,007,, uGeneral Chemistry I Workshop, uEdward J  Valente, u4:10 pm,5:35 pm, uT
CHM,007,, uGeneral Chemistry I Workshop, uEdward J  Valente, u7:10 pm,8:35 pm, uT
CHM,008,, uGeneral Chemistry II Workshop, uKevin   Cantrell, u5:40 pm,7:05 pm, uW
CHM,008,, uGeneral Chemistry II Workshop, uKevin   Cantrell, u7:10 pm,8:35 pm, uW
CHM,008,, uGeneral Chemistry II Workshop, uKevin   Cantrell, u4:10 pm,5:35 pm, uT
CHM,008,, uGeneral Chemistry II Workshop, uKevin   Cantrell, u4:10 pm,5:35 pm, uW
CHM,008,, uGeneral Chemistry II Workshop, uElizabeth Ruth  Morton, u5:40 pm,7:05 pm, uW
CHM,008,, uGeneral Chemistry II Workshop, uElizabeth Ruth  Morton, u7:10 pm,8:35 pm, uW
CHM,008,, uGeneral Chemistry II Workshop, uElizabeth Ruth  Morton, u5:40 pm,7:05 pm, uT
CHM,008,, uGeneral Chemistry II Workshop, uElizabeth Ruth  Morton, u4:10 pm,5:35 pm, uW
CHM,008,, uGeneral Chemistry II Workshop, uSylvia M.  Daoud Kinzie, u5:40 pm,7:05 pm, uM
CHM,008,, uGeneral Chemistry II Workshop, uSylvia M.  Daoud Kinzie, u7:10 pm,8:35 pm, uM
CHM,008,, uGeneral Chemistry II Workshop, uSylvia M.  Daoud Kinzie, u4:10 pm,5:35 pm, uT
CHM,008,, uGeneral Chemistry II Workshop, uSylvia M.  Daoud Kinzie, u7:10 pm,8:35 pm, uT
CHM,008,, uGeneral Chemistry II Workshop, uSylvia M.  Daoud Kinzie, u5:40 pm,7:05 pm, uM
CHM,008,, uGeneral Chemistry II Workshop, uSylvia M.  Daoud Kinzie, u7:10 pm,8:35 pm, uM
CHM,008,, uGeneral Chemistry II Workshop, uSylvia M.  Daoud Kinzie, u5:40 pm,7:05 pm, uT
CHM,008,, uGeneral Chemistry II Workshop, uSylvia M.  Daoud Kinzie, u7:10 pm,8:35 pm, uT
CHM,008,, uGeneral Chemistry II Workshop, uEugenijus   Urnezius, u5:40 pm,7:05 pm, uM
CHM,008,, uGeneral Chemistry II Workshop, uEugenijus   Urnezius, u4:10 pm,5:35 pm, uT
CHM,025,, uOrganic Chemistry I Workshop, uRonda Sandifer  Bard, u7:10 pm,8:35 pm, uW
CHM,025,, uOrganic Chemistry I Workshop, uRonda Sandifer  Bard, u5:40 pm,7:05 pm, uW
CHM,025,, uOrganic Chemistry I Workshop, uRonda Sandifer  Bard, u7:10 pm,8:35 pm, uT
CHM,026,, uOrganic Chemistry II Workshop, uEdward J  Valente, u7:10 pm,8:35 pm, uW
CHM,026,, uOrganic Chemistry II Workshop, uEdward J  Valente, u4:10 pm,5:35 pm, uR
CHM,026,, uOrganic Chemistry II Workshop, uEdward J  Valente, u5:40 pm,7:05 pm, uR
CHM,026,, uOrganic Chemistry II Workshop, uWarren J  Wood, u7:10 pm,8:35 pm, uW
CHM,026,, uOrganic Chemistry II Workshop, uWarren J  Wood, u4:10 pm,5:35 pm, uR
CHM,026,, uOrganic Chemistry II Workshop, uWarren J  Wood, u5:40 pm,7:05 pm, uR
CHM,026,, uOrganic Chemistry II Workshop, uBuck   Taylor, u7:10 pm,8:35 pm, uW
CHM,026,, uOrganic Chemistry II Workshop, uBuck   Taylor, u5:40 pm,7:05 pm, uR
CHM,026,, uOrganic Chemistry II Workshop, uBuck   Taylor, u7:10 pm,8:35 pm, uR
CHM,026,, uOrganic Chemistry II Workshop, uBuck   Taylor, u7:10 pm,8:35 pm, uW
CHM,026,, uOrganic Chemistry II Workshop, uBuck   Taylor, u4:10 pm,5:35 pm, uR
CHM,026,, uOrganic Chemistry II Workshop, uBuck   Taylor, u5:40 pm,7:05 pm, uR
CHM,105,, uChemistry in Art, uValerie A  Walters, u4:10 pm,6:55 pm, uR
CHM,207,, uGeneral Chemistry I, uAngela   Hoffman, u8:10 am,9:05 am, uMWF
CHM,207,, uGeneral Chemistry I, uElizabeth Ruth  Morton, u2:30 pm,3:55 pm, uTR
CHM,207,, uGeneral Chemistry I, uRachel   Hutcheson, u11:25 am,12:20 pm, uMWF
CHM,207,, uGeneral Chemistry I, uEdward J  Valente, u9:15 am,10:10 am, uMWF
CHM,208,, uGeneral Chemistry II, uKevin   Cantrell, u12:55 pm,2:20 pm, uTR
CHM,208,, uGeneral Chemistry II, uElizabeth Ruth  Morton, u11:20 am,12:45 pm, uTR
CHM,208,, uGeneral Chemistry II, uSylvia M.  Daoud Kinzie, u11:25 am,12:20 pm, uMWF
CHM,208,, uGeneral Chemistry II, uSylvia M.  Daoud Kinzie, u12:30 pm,1:25 pm, uMWF
CHM,208,, uGeneral Chemistry II, uEugenijus   Urnezius, u8:10 am,9:05 am, uMWF
CHM,277,, uGeneral Chemistry I Laboratory, uMahbubur   Rahman, u6:10 pm,9:10 pm, uR
CHM,277,, uGeneral Chemistry I Laboratory, uWallace   Thompson, u6:10 pm,9:10 pm, uM
CHM,277,, uGeneral Chemistry I Laboratory, uWilson   Jacob, u8:10 am,11:10 am, uT
CHM,277,, uGeneral Chemistry I Laboratory, uMahbubur   Rahman, u6:10 pm,9:10 pm, uW
CHM,277,, uGeneral Chemistry I Laboratory, uValerie A  Walters, u8:10 am,11:10 am, uR
CHM,277,, uGeneral Chemistry I Laboratory, uBarbara Lynn Walton  Pasquale, u8:10 am,11:10 am, uR
CHM,277,, uGeneral Chemistry I Laboratory, uSylvia M.  Daoud Kinzie, u8:10 am,11:10 am, uT
CHM,278,, uGeneral Chemistry II Laboratory, uSylvia M.  Daoud Kinzie, u12:55 pm,3:55 pm, uT
CHM,278,, uGeneral Chemistry II Laboratory, uLaura Nicole  Schacherer, u6:10 pm,9:10 pm, uT
CHM,278,, uGeneral Chemistry II Laboratory, uSteven   Soll, u1:35 pm,4:35 pm, uW
CHM,278,, uGeneral Chemistry II Laboratory, uWilson   Jacob, u12:55 pm,3:55 pm, uR
CHM,278,, uGeneral Chemistry II Laboratory, uBarbara Lynn Walton  Pasquale, u6:10 pm,9:10 pm, uR
CHM,278,, uGeneral Chemistry II Laboratory, uWallace   Thompson, u6:10 pm,9:10 pm, uT
CHM,278,, uGeneral Chemistry II Laboratory, uValerie A  Walters, u1:35 pm,4:35 pm, uM
CHM,278,, uGeneral Chemistry II Laboratory, uElizabeth Ruth  Morton, u1:35 pm,4:35 pm, uM
CHM,278,, uGeneral Chemistry II Laboratory, uElizabeth Conrad  Wilkinson, u1:35 pm,4:35 pm, uF
CHM,278,, uGeneral Chemistry II Laboratory, uWilson   Jacob, u6:10 pm,9:10 pm, uM
CHM,325,, uOrganic Chemistry I, uRonda Sandifer  Bard, u8:10 am,9:35 am, uTR
CHM,326,, uOrganic Chemistry II, uEdward J  Valente, u8:10 am,9:05 am, uMWF
CHM,326,, uOrganic Chemistry II, uWarren J  Wood, u9:15 am,10:10 am, uMWF
CHM,326,, uOrganic Chemistry II, uBuck   Taylor, u10:20 am,11:15 am, uMWF
CHM,326,, uOrganic Chemistry II, uBuck   Taylor, u11:25 am,12:20 pm, uMWF
CHM,332,, uPhysical Chemistry II, uSteven G  Mayer, u9:45 am,11:10 am, uTR
CHM,344,, uInorganic Chemistry I, uEugenijus   Urnezius, u11:25 am,12:20 pm, uMWF
CHM,372,, uPhysical Chemistry I Laboratory, uSteven G  Mayer, u1:35 pm,4:35 pm, uM
CHM,372,, uPhysical Chemistry I Laboratory, uSteven G  Mayer, u12:55 pm,3:55 pm, uT
CHM,374,, uInorganic Chemistry I Laboratory, uEugenijus   Urnezius, u1:35 pm,4:35 pm, uW
CHM,374,, uInorganic Chemistry I Laboratory, uElizabeth Ruth  Morton, u6:10 pm,9:10 pm, uW
CHM,375,, uOrganic Chemistry I Laboratory, uRonda Sandifer  Bard, u1:35 pm,4:35 pm, uM
CHM,375,, uOrganic Chemistry I Laboratory, uKara J  Breuer, u6:10 pm,9:10 pm, uM
CHM,376,, uOrganic Chemistry II Laboratory, uEdward J  Valente, u8:10 am,11:10 am, uT
CHM,376,, uOrganic Chemistry II Laboratory, uWarren J  Wood, u12:55 pm,3:55 pm, uT
